identifier;title;coverDate;citedCount;subtypeDescription;openaccessFlag;authors;origin;used
105020568148;Multi-dimensional Engagement for Richer Hyperlocal Citizen Science Data;2025-10-01;0.0;Conference Paper;True;Abhishek Viswanathan, Vasco Xu, Amy Babay, Rosta Farzan, Aaron Birdy;acm;True
85128418579;Instagram of Rivers: Facilitating Distributed Collaboration in Hyperlocal Citizen Science;2022-04-07;7.0;Article;False;Srishti Gupta, Julia Jablonski, Chun Hua Tsai, John M. Carroll;acm;False
85097231160;Smell Pittsburgh: Engaging Community Citizen Science for AirQuality;2020-01-01;26.0;Article;False;Yen Chia Hsu, Jennifer Cross, Paul Dille, Michael Tasota, Beatrice Dias, Randy Sargent, Ting Hao (Kenneth) Huang, Illah Nourbakhsh;acm;True
85161470565;Revealing the role of values in developing a garden data ecosystem through a reflective participatory design approach;2023-05-29;0.0;Conference Paper;True;Silvia Cazacu, Ingrid Mulder, Andrew Vande Moere, Thérèse Steenberghen;acm;False
105009231192;Use of Air Quality Sensor Network Data for Real-time Pollution-Aware POI Suggestion;2025-05-23;1.0;Conference Paper;True;Giuseppe Fasano, Yashar Deldjoo, Tommaso di Noia, Bianca Lau, Sina Adham-Khiabani, Eric Morris, Xia Liu, Ganga Chinna Rao Devarapu, Liam O'Faolain;acm;True
85133632204;The Air Quality Lens: Ambiguity as Opportunity to Reactivate Environmental Data;2022-06-13;7.0;Conference Paper;False;Teis De Greve, Steven Malliet, Niels Hendriks, Bieke Zaman;acm;True
85174248748;What Does Air Quality Sound Like? On Exploring the impact of Data Sonification Versus Data Visualization;2023-09-06;0.0;Conference Paper;True;Chiara Ceccarini, Gianni Tumedei, Catia Prandi;acm;True
85127124711;AQ-SCIENCE: Air Quality - Smart Cities with IoT-ENabled Citizen Engagement Approach;2022-03-08;5.0;Conference Paper;False;Rameez Raja Kureshi, Dhavalkumar Thakker, Bhupesh Kumar Mishra, Reena John;acm;True
85211376808;GraPhy: Graph-Based Physics-Guided Urban Air Quality Modeling for Monitoring-Constrained Regions;2024-10-29;0.0;Conference Paper;True;Shangjie Du, Zhi Zhang Hu, Shijia Pan;acm;False
85198642894;A STEM Approach to Teach High School Students IoT and AI Concepts: An Air Quality Example;2024-07-08;4.0;Conference Paper;False;Wei Ling Lee, Chiu Fan Hu, Cheng Chih Wu;acm;True
85146367510;SenseMyStreet: Sensor Commissioning Toolkit for Communities;2022-11-11;9.0;Article;True;Aare Puussaar, Kyle Montague, Sean Peacock, Thomas Nappey, Robert Anderson, Jennine Jonczyk, Peter Wright, Philip James;acm;False
85146308992;From Environmental Monitoring to Mitigation Action: Considerations, Challenges, and Opportunities for HCI;2022-11-11;8.0;Article;False;Graham Dove, Shiyu Chen, Daniel Fries, Vanessa Johnson, Charlie Mydlarz, Juan Pablo Bello, Oded Nov;acm;False
85137594900;Opportunities and risks for engaging research participants with self-logged menstrual health data;2022-08-17;2.0;Conference Paper;True;Samantha Robertson, Kim G. Harley, Niloufar Salehi;acm;False
85102063335;Towards Atmospheric Interfaces;2021-02-14;6.0;Conference Paper;False;Jessica Broscheit, Qi Wang, Susanne Draheim, Kai Von Luck;acm;True
85192198334;Real-time Route Planning to Reduce Pedestrian Pollution Exposure in Urban Settings;2023-12-04;2.0;Conference Paper;True;Richard Sinnott, Siqi Zhong;acm;False
85209239146;Addressing Data Challenges to Drive the Transformation of Smart Cities;2024-11-07;14.0;Article;True;Ekaterina Gilman, Francesca Bugiotti, Ahmed Khalid, Hassan Mehmood, Panos Kostakos, Lauri Tuovinen, Johanna Ylipulli, Xiang Su, Denzil Ferreira;acm;False
85091280338;Engaging the Commons in Participatory Sensing: Practice, Problems, and Promise in the Context of Dockless Bikesharing;2020-04-21;7.0;Conference Paper;False;Ge Gao, Yuling Sun, Yongle Zhang;acm;False
105013473958;AmIAire: A Citizen Science and Action Research Initiative for Air Quality Monitoring and Behavioral Change;2025-01-01;0.0;Conference Paper;False;Ibai Gomez Vazquez, Syed Mohsin Ali Shah, Diego Casado-Mansilla, Diego Lopez-De-Ipina;ieee;True
85215112724;Implementation of an Open Hardware and Web Platform for Citizen Science Air Quality Monitoring;2024-01-01;1.0;Conference Paper;False;Ryan Jonathan Blanco, Joize Barbie E.Dela Cruz, Ira Nicole J. Santos, Jaybie De Guzman, Marc D. Rosales, Paul Jason Co, John Jairus Eslit, Percival Magpantay, John Richard E. Hizon;ieee;True
85168117828;The BeeMate: Air quality monitoring through crowdsourced audiovisual data;2023-01-01;3.0;Conference Paper;False;Nikolaos Vryzas, Marina Eirini Stamatiadou, Lazaros Vrysis, Charalampos Dimoulas;ieee;True
85203668000;Citizens Sensing Emissions - First Results of a Citizen Science Project;2024-01-01;0.0;Conference Paper;False;Max Czymai, Kim Eschenbach, Robin Hoske, Melanie Jaeger-Erben, Manfred Kraft, Max Marwede;ieee;True
85178325420;SOCIO-BEE: A Next-Generation Citizen Science Platform for Citizens' Engagement to Air Pollution Measuring;2023-01-01;3.0;Conference Paper;False;Dimitrios Karanassos, Charalampos Kyfonidis, Georgios Angelis, Alexandros Emvoliadis, Traianos Ioannis Theodorou, Alexandros Zamichos, Anastasios Drosou, Dimitrios Tzovaras;ieee;True
85216087596;CEDAR: An Augmented Reality Mobile Application Using a Participatory Design Framework for Citizen Science Data Sensing;2024-01-01;0.0;Conference Paper;False;Mengci Liu, Peter Hall, Stella Doukianou, Anna Troisi;ieee;True
105016462142;Boosting behavioral change and citizens engagement in cities through technology: The DivAirCity project approach;2025-01-01;0.0;Conference Paper;False;Achilleas I. Sfetkos, Ioanna D. Pasiopoulou, Grigoris K. Papagiannis;ieee;True
85205993088;Citizens4Climate - A dashboard to support citizen science activities for climate action;2024-01-01;2.0;Conference Paper;False;Sasa Vranic, Antonella Galizia, Antonio Parodi, Ulrike Falk, Paolo Mazzetti, Milan Kalas, Joy Ommer;ieee;True
85094132318;MegaSense: Cyber-Physical System for Real-time Urban Air Quality Monitoring;2020-11-09;27.0;Conference Paper;False;Andrew Rebeiro-Hargrave, Naser Hossein Motlagh, Samu Varjonen, Eemil Lagerspetz, Petteri Nurmi, Sasu Tarkoma;ieee;True
105013463140;Validating a Citizen Observatories enabling Platform by completing a Citizen Science Loop;2025-01-01;0.0;Conference Paper;False;Diego Lopez-De-Ipina, Dawid Wolosiuk, Felipe Eduardo Vergara, Mikel Emaldi, Ruben Sanchez-Corcuera, Alex Barco, Milena Vuckovic, Diego Casado-Mansilla, Jan Peters-Anders;ieee;True
85112266275;Crowd-sourcing: Citizens as scientists for air pollution monitoring;2021-06-16;0.0;Conference Paper;False;Beti Angelevska, Igor Andreevski, Vaska Atanasova;ieee;True
85138138896;Design and implementation of an open-source urban mobility web service based on environmental quality and bicycle mobility data;2022-01-01;3.0;Conference Paper;False;Ander Eguiluz, Unai Hernandez-Jayo, Diego Casado-Mansilla, Diego Lopez-De-Ipina, Andoni Eguiluz Moran;ieee;True
85094824495;A Clean Air Journey Planner for pedestrians using high resolution near real time air quality data;2020-07-01;7.0;Conference Paper;False;Antti Nurminen, Avleen Malhi, Lasse Johansson, Kary Framling;ieee;True
85087924481;Apollon project: A massive online open lab for citizen science driven environmental monitoring;2020-04-01;3.0;Conference Paper;False;Antonella Longo, Mario A. Bochicchio, Marco Zappatore;ieee;True
85174387529;HealthAir: A Crowdsourcing mHealth Platform for Air Pollution Effects on Citizens Health Status;2023-01-01;2.0;Conference Paper;False;Ioannis Katsidimas, Sotiris Nikoletseas, Stefanos H. Panagiotou, Christina Spyropoulou;ieee;True
85215251198;Development of a Multi-Sensor Mobile Device for Urban Air Quality Monitoring at the Street Corner: The SMILE Project;2025-01-01;0.0;Article;True;Jonas Pellegrino, Hassen Aziza, Mathieu Guerin, Pascal Taranto, Wenceslas Rahajandraibe, Blaise Ravelo;ieee;True
85174241238;Pollution Runner: a Serious Game to Promote Awareness Towards Air Pollution;2023-01-01;2.0;Conference Paper;False;Mattia Fortunati, Antonella Galizia;ieee;True
85186524383;Breathing Green: Maximising Health and Environmental Benefits for Active Transportation Users Leveraging Large Scale Air Quality Data;2023-01-01;4.0;Conference Paper;False;Sen Yan, Shaoshu Zhu, Jaime B. Fernandez, Eric Arazo Sanchez, Yingqi Gu, Noel E. O'connor, David O'connor, Mingming Liu;ieee;True
85207044719;Towards an Integrated Smart City Platform: A Prototype for Enhancing Urban Services;2024-01-01;0.0;Conference Paper;False;Assis Tanji, Mohamed Essaaidi, Ghezlane Halhoul Merabet;ieee;True
85122994727;Real-time Route Planning using Mobile Air Pollution Detectors and Citizen Scientists;2021-01-01;2.0;Conference Paper;False;Richard O. Sinnott, Yuan Wang, Yiqun Wang;ieee;True
85172012036;Web-based 3D Smog Visualization for Air Pollution Analysis;2022-01-01;1.0;Conference Paper;False;Jordan Limperis, Felix Hamza-Lup, Weitian Tong;ieee;True
85145349941;Raising citizens and institutions awareness of environmental problems using smart sensing technologies;2022-01-01;0.0;Conference Paper;False;Andres Calandin Vega, Jose Giner Perez De Lucia, Jose Luis Poza-Lujan, Jose M. Cecilia, Carlos T. Calafate, Pietro Manzoni;ieee;True
85218027929;Peace Engineering - New Mexico Dashboard Case Study;2024-01-01;0.0;Conference Paper;False;Ramiro Jordan, Manel Martinez-Ramon, Donna Koechner, Norm Gaume, Sriram Thotakura, Peter Coha;ieee;True
85139392942;A Social Internet of Things Smart City Solution for Traffic and Pollution Monitoring in Cagliari;2023-02-01;43.0;Article;False;Mauro Fadda, Matteo Anedda, Roberto Girau, Giovanni Pau, Daniele D. Giusto;ieee;True
105001645826;Model-Driven Development of Web Augmenters for Facilitating Environmental Open Data Consumption;2025-01-01;0.0;Article;True;Paula Gonzalez-Martinez, Cesar Gonzalez-Mora, Irene Garrigos, Jose Norberto Mazon, Jose M. Cecilia;ieee;True
105018475633;Health-Aware Path Planning Using Environmental Data and Sequential Prediction Models for Asthma Management;2025-01-01;0.0;Conference Paper;False;Nada Ayman, Shaimaa Alaa, Ali Hamdi;ieee;True
85099743101;Streamlining Smart Cities to Create Safer Spaces;2020-10-28;4.0;Conference Paper;False;Randy Krauss, Matthew Vaysfeld, Murad Arslaner, Gregg Vesonder;ieee;True
85168155131;Calibration strategies for low-cost compact field sensors in Citizen Science Air Quality measurements: Insights from SOCIO-BEE project;2023-01-01;1.0;Conference Paper;False;Maria Kotzagianni, Amirhossein Hassani, Nicole Morresi, Sergi Udina, Charalampos Kyfonidis, Anargyros Roussos, Sara Casaccia, Gian Marco Revel, Beatriz Noriega-Ortega;ieee;False
105004665783;Crowdsourced and Social Media Data for Environmental Monitoring and Disaster Response: A Dual Case Study of Real-time Flood Tracking and Air Quality Surveillance;2024-01-01;0.0;Conference Paper;False;Sachin Pal, None Tanushka, Kanishka Jha, Deepika Sharma, Prateek Sahani, Ayush Awathi;ieee;False
85202452111;Performance Assessment of Wearable Atmotube Pro Sensor for Air Quality Citizen Science Applications;2024-01-01;3.0;Conference Paper;False;Alejandro Pujante Pérez, Eduardo Illueca Fernández, Syed Mohsin Ali Shah, Diego Casado-Mansilla, Antonio Jesús Jara Valera, Diego López-De-Ipiña;ieee;False
85116451075;Data Quality Estimation in a Smart City's Air Quality Monitoring IoT Application;2021-08-25;9.0;Conference Paper;False;P. Julio, B. Fernando, G. Natalia Gaviria, R. Danny;ieee;False
85119850222;Use Case of Building an Indoor Air Quality Monitoring System;2021-06-14;6.0;Conference Paper;False;Rameez Raja Kureshi, Dhavalkumar Thakker, Bhupesh Kumar Mishra, Baseer Ahmed;ieee;False
105013461503;Citizen Science for Sustainable Energy Transition and Air Quality: Social Perception and Evidence-Based Policymaking in Krzywcza (Poland);2025-01-01;0.0;Conference Paper;False;Monika Peplowska, Dominik Kryzia, Wojciech Kowalik, Wit Hubert;ieee;False
85186665910;Breathing in Jakarta: Uncovering the Air Quality Index using Data Visualization;2023-01-01;3.0;Conference Paper;False;Fabian Surya Pramudya, Felix Indra Kurniadi, Aldilla Noor Rakhiemah;ieee;False
85126102578;Evaluation of particulate matter microsensors to build the low-cost sensors collaborative network of Bogota;2021-01-01;1.0;Conference Paper;False;Fredy Escobar-Diaz, Camila Buitrago, Leonardo Quinones, Freddy Grajales, Tatiana Mejia;ieee;False
85202431702;Enhancing Citizen Science Engagement Through Gamification: A Case Study of the SOCIO-BEE Project;2024-01-01;3.0;Conference Paper;False;Felipe Vergara, Cristian Olivares-Rodríguez, Mariluz Guenaga, Diego López-De-Ipiña, Maite Puerta-Beldarrain, Rubén Sánchez-Corcuera;ieee;False
85196730657;SOCIO-BEE: Example of a Citizen Science Community for the Co-Creation of Measures to Reduce the Impact of Environmental Pollution in the Framework of Smart Cities;2023-01-01;1.0;Conference Paper;False;Unai Hernandez-Jayo, Javier Garcia-Zubia, Diego Lopez-De-Ipina, Diego Casado-Mansilla, Maite Puerta-Beldarrain, Alexandre Barco Martelo;ieee;False
85196096797;Air quality in Delhi during the 2022 Diwali festival: evaluation of low-cost community sensors compared to ground-based government and satellite observations;2024-01-01;0.0;Conference Paper;False;Niranjan Srivats Chandrasekhar, Carolynne Hultquist;ieee;False
85168087814;Agency and responsibility in smart air pollution monitoring;2023-01-01;0.0;Conference Paper;False;Karin Ekman, Marisa Ponti, Marc Peñalver Grau, Nuria Castell, Rasmus Nedergård Steffansen, Enza Lissandrello;ieee;False
85202450434;A Low-Cost Image Sensor for Particulate Matter Detection to Streamline Citizen Science Campaigns on Air Quality Monitoring;2024-01-01;1.0;Conference Paper;False;Syed Mohsin Ali Shah, Diego Casado-Mansilla, Diego López-De-Ipiña, Eduardo Illueca Fernández, Amir Hossein Hassani, Alejandro Pujante Pérez;ieee;False
85168143329;A Micro-volunteering Engine to drive crowd-measuring of Air Quality in Citizen Science;2023-01-01;0.0;Conference Paper;False;Maite Puerta-Beldarrain, Oihane Gómez-Carmona, Diego López-De-Ipiña, Diego Casado-Mansilla, Alexandre Barco, Unai Hernández Jayo, Javier García-Zubia;ieee;False
85142118310;Smart City Data in Urban Wellbeing Estimation;2022-01-01;0.0;Conference Paper;False;Tzirath Perez Oteiza, Peter Mooney, Liadh Kelly;ieee;False
85164534994;Low-Cost, Open, Citizen Science with IoT and TinyML;2023-01-01;2.0;Conference Paper;False;Narasimha Sai Yamanoor, Srihari Yamanoor, Satyakanth Thyagara;ieee;False
85084394600;Bridging data gap for understanding emerging issues in Niger: Challenges and opportunities in the era of smart cities and smart villages;2020-02-01;4.0;Conference Paper;False;Ibrahim Sidi Zakari;ieee;False
85174279702;Enhancing Learning About Climate Change Issues Among Secondary School Students with Citizen Science Tools;2023-01-01;3.0;Conference Paper;False;Muhammad Adnan, Luk Knapen, Wim Ectors, Lien Aerts;ieee;False
85114282548;Mining atmospheric data;2021-06-28;1.0;Conference Paper;False;Chaabane Djeraba, Jerome Riedi;ieee;False
85142048548;Data Cleaning to fine-tune a Transfer Learning approach for Air Quality Prediction;2022-01-01;6.0;Conference Paper;False;Marie Njaime, Fahed Abdallah Olivier, Hichem Snoussi, Judy Akl, Charbel Chahla, Hichem Omrani;ieee;False
105001507783;WeAIR: Wearable Swarm Sensors for Air Quality Monitoring to Foster Citizens’ Awareness of Climate Change;2025-08-01;0.0;Article;True;Giovanna Maria Dimitri, Lorenzo Parri, Eleonora Vitanza, Alessandro Pozzebon, Ada Fort, Chiara Mocenni;ieee;False
105015378155;IoT-Based Environmental Monitoring for Urban Air Quality Improvement Using Kalman Filters and Clustering Algorithms;2025-01-01;0.0;Conference Paper;False;K. Prathap Kumar, R. B. Saroo Raj, S. Maflin Shaby, T. Gomathi;ieee;False
85150678878;Prediction of Air Quality using Deep Learning based Model with CRO;2022-01-01;3.0;Conference Paper;False;Piyush Kumar Pareek, S. G. Gollagi, B. D. Parameshachari, Mohandas Karamthoti;ieee;False
85186770149;Presenting an Edge-based Air Quality Management System for Smart City Scenarios;2023-01-01;0.0;Conference Paper;False;Tina Samizadeh Nikoui, Ali Balador, Amir Masoud Rahmani, Hooman Tabarsaied;ieee;False
85202430615;Democratizing Co-production of Thematic Co-explorations for Citizen Observatories;2024-01-01;1.0;Conference Paper;False;Diego López-De-Ipina, Rubén Sánchez-Corcuera, Felipe Eduardo Vergara, Mikel Emaldi, Dawid Wolosiuk, Diego Casado-Mansilla, Alessandra Feliciotti, Jan Peters-Anders;ieee;False
105016778136;IoT-Based Air Quality Monitoring and Alert System: Addressing Pollution Challenges in Indian Metropolises;2025-01-01;0.0;Conference Paper;False;Vishal S. Wadkar, B. Rampriya, S. Sundararajan, Ashwini Jotiram Patil, Gautham Krishna, S. Kaliappan;ieee;False
85116455925;Spatial-Temporal Dynamic Graph Convolution Neural Network for Air Quality Prediction;2021-07-18;29.0;Conference Paper;False;Xiaocao Ouyang, Yan Yang, Yiling Zhang, Wei Zhou;ieee;False
105016315537;Geospatial Machine Learning for Air Pollution Prediction and Risk Assessment;2025-01-01;0.0;Conference Paper;False;Aishani Chakraborty, Asmita Rani, K. C. Sriharipriya, Sundresan Perumal, Aparna Mohanty;ieee;False
85126026219;RAPID ACTION ON COVID-19 AND EARTH OBSERVATION: AN INITTIATIVE FOR SOCIETAL INFORMATION ENABLED BY COPERNICUS SENTINELS DATA;2021-01-01;0.0;Conference Paper;False;Yves Louis Desnos, Elisabeth Hamdouch, Anca Anghelea, Guenther Landgraf, Simonetta Cheli, Julien Turpin;ieee;False
105003907970;Sensor Networks for Real-Time Air Quality Monitoring in Smart Cities;2025-01-01;0.0;Conference Paper;False;Neeraj Das, Ashu Katyal, Pratik Dutta, Prateek Aggarwal, P. S. Pavan, Kalist Vincent;ieee;False
85145357911;Preliminary Study on Abnormality Detection of Airbox Sensor Device;2022-01-01;0.0;Conference Paper;False;Wen Lung Tsai, Ya Han Zhang;ieee;False
85168668191;Air Quality as Proxy for Assesment of Economic Activity;2023-01-01;1.0;Conference Paper;False;Hanna Yailymova, Andrii Kolotii, Nataliia Kussul, Andrii Shelestov;ieee;False
85207837702;Assessing the Role of Environmental Awareness in Air Quality Enhancement;2024-01-01;2.0;Conference Paper;False;Wahyu Hidayat, Calandra Alencia Haryani, Virendra Tesla Arshaka Faturahman, Nur Aulia Lindzani, Rio Wahyudin Anugrah;ieee;False
85202526205;Devising a Responsible Framework for Air Quality Sensor Placement;2024-01-01;0.0;Conference Paper;False;Jevon Westcarr, Venkata M.V. Gunturi, Sheen Mc Lean Cabaneros, Rameez Raja Kureshi, Dhavalkumar Thakker, Amanda Porter;ieee;False
85207319332;Systematic Literature Review of Data Quality in Open Government Data: Trend, Methods, and Applications;2024-01-01;2.0;Article;True;Zahirah Zainuddin, Emelia Akashah P. Akhir;ieee;False
85204909352;Digital Twin Ready Data Available in the Green Deal Data Space;2024-01-01;0.0;Conference Paper;False;Joan Masó, Alba Brobia, Malte Zamzov, Ivette Serall, Thomas Hodson, Raul Palma, Francesca Noardo, Lucy Bastin, Victoria Lush;ieee;False
85186763308;Integration of Wireless Sensor Networks and IoT for air quality monitoring;2023-01-01;2.0;Conference Paper;False;Diego Quiroga, Sergio Diaz, Homero F. Pastrana;ieee;False
85212092938;LSTM-Based Citizens’ QoL Provisioning in Smart Cities Using IoT-Enabled Environmental Sensors and Graphical Tools;2025-01-01;0.0;Article;False;Zhiqing Bai, Xuan Yang, Junzhi Xiang, Hani Attar, Lingyun Lu, Mohamadreza Khosravi, Hailin Qin, Xiaolong Zhao, Zongjiu Zhu, Dejuan Li;ieee;False
85202432002;Designing Interactive Analytics Dashboards for Diverse Target Groups: The Process and Decision-Making;2024-01-01;2.0;Conference Paper;False;Milena Vuckovic, Dawid Wolosiuk, Johanna Schmidt;ieee;False
85135246719;MARVAir: Meteorology Augmented Residual-Based Visual Approach for Crowdsourcing Air Quality Inference;2022-01-01;6.0;Article;False;Muyan Yao, Dan Tao, Jiangtao Wang, Ruipeng Gao, Kunning Sun;ieee;False
85187342847;Improving Air Quality Zoning Through Deep Learning and Hyperlocal Measurements;2024-01-01;9.0;Article;True;Eduardo Illueca Fernandez, Antonio Jesus Jara Valera, Jesualdo Tomas Fernandez Breis;ieee;False
85127878438;Hands-On Computer Science: The Array of Things Experimental Urban Instrument;2022-01-01;15.0;Article;False;Charlie Catlett, Pete Beckman, Nicola Ferrier, Michael E. Papka, Rajesh Sankaran, Jeff Solin, Valerie Taylor, Douglas Pancoast, Daniel Reed;ieee;False
85095765631;Short-term air pollution forecasting based on environmental factors and deep learning models;2020-09-01;18.0;Conference Paper;True;Mirche Arsov, Eftim Zdravevski, Petre Lameski, Roberto Corizzo, Nikola Koteli, Kosta Mitreski, Vladimir Trajkovik;ieee;False
85119516391;A Comprehensive Analysis of Machine Learning Methods for Air Pollution Forecasting;2021-09-23;4.0;Conference Paper;False;J. Mohith, Divij Kulshrestha, K. R. Jothi;ieee;False
85134382993;Fog abetted Early Alert System for Monitoring Air Pollution in Smart Cities;2022-01-01;6.0;Conference Paper;False;Banani Ghose, Zeenat Rehena;ieee;False
105013472122;A Strategy for Enhancing Privacy and Usability of Crowdsourced Data;2025-01-01;0.0;Conference Paper;False;Dawid Wolosiuk, Milena Vuckovic, Jan Peters-Anders, Felipe Eduardo Vergara, Ruben Sanchez Corcuera, Diego Lopez-De-Ipina;ieee;False
85081644376;Spatiotemporal Patterns of Visitors in Urban Green Parks by Mining Social Media Big Data Based upon WHO Reports;2020-01-01;39.0;Article;True;Hidayat Ullah, Wanggen Wan, Saqib Ali Haidery, Naimat Ullah Khan, Zeinab Ebrahimpour, A. A.M. Muzahid;ieee;False
85116238943;The use of a data-driven digital twin of a smart city: A case study of ålesund, norway;2021-10-01;45.0;Article;False;Pierre Major, Guoyuan Li, Hans Petter Hildre, Houxiang Zhang;ieee;False
85128177648;Exploring the impact of COVID-19 on travel behavior based on EV charging big data;2021-01-01;0.0;Conference Paper;False;Kaile Zhou, Dingding Hu, Fangyi Li;ieee;False
85184806508;Innovating Smart Buildings and Cities Through Agent-Based Modeling, Discrete Event Simulation and Sensor-Based Data Analytics;2023-01-01;0.0;Conference Paper;False;Juliane Lopinski, Sabine Sachweh, Claudia Muller;ieee;False
105013461636;A Novel Framework for Safeguarding Individual Rights in Smart City Development;2025-01-01;0.0;Conference Paper;False;M. Sivasakthi, D. Lakshminarayanan, V. Raji, E. Rajendran;ieee;False
105002727254;Role of IoT in Smart Cities: A Review, Applications, Open Challenges and Solutions;2025-01-01;1.0;Conference Paper;False;Kolla Vivek, Gurrala Swetha, V. T.Ram Pavan Kumar M, Anusuri Krishna Veni, Neti Praveen, Masthan Rao Kale;ieee;False
85182283434;The Social Impact of Smart Cities: A Comprehensive Study with Digital Solutions;2023-01-01;0.0;Conference Paper;False;Jayendira P. Sankar, Muhammad Abrarulhaq, Farheen Akram, Gazi Md Nurul Islam;ieee;False
85199046426;IoT and Generative AI Technologies to Support Urban Environmental Learning;2024-01-01;3.0;Conference Paper;False;Bernardo Tabuenca, Sergio Martín, Wolfgang Greller, Alexander Tillmann, Manuel Uche-Soria, Manuel Castro, Edmundo Tovar, Miguel Rodríguez-Artacho;ieee;False
85211763891;Robust SmartCityAI Lakehouse: IKN (New Capital City of Indonesia) Case Study;2024-01-01;2.0;Conference Paper;False;Davy Ronald Hermanus, Danny Robert Hermanus, Fadhil Hidayat, Suhono Harso Supangat;ieee;False
85173587918;Location Verification of Crowd-Sourced Sensors;2023-01-01;0.0;Conference Paper;False;Christopher Kitras, Carter Pollan, Kyle Myers, Camille Wirthlin Tischner, Philip Lundrigan;ieee;False
105019537136;Interoperable FIWARE Architecture for Smart Building Management and Real-Time Data Processing;2025-01-01;0.0;Conference Paper;False;Sebastian Nicolae Matusa, Radu Nicolae Pietraru;ieee;False
85196810264;Assessment and Prediction of Urban Pollutants and its Influence on Human Health using Deep Learning Algorithm;2024-01-01;3.0;Conference Paper;False;Vaishali Kavathekar, Amiya Kumar Tripathy, Sarat Kumar Chettri, Vinayak Bhanage, Mohammad Zaidansari, Lavena Babu, Allen Joshua;ieee;False
85134881034;Water Care System (WCS) for Numeric Water Quality Criteria (NWQC) with IoT/IoUT-Educational Implications of Sustainability Goal SDG 14;2022-01-01;2.0;Conference Paper;False;Rasma Tretjakova, Hans Petter Halvorsen, Hakon Viumdal, Saba Mylvaganam, Josef Timmerberg, Jean Marc Thiriet;ieee;False
85115405679;Coping with COVID-19 by Community Landscape Design in the Digital Technology based on big data;2020-12-01;0.0;Conference Paper;False;Zesong Wei, Shicun Sun;ieee;False
85179557674;PM2.5 Prediction using Deep Learning Models;2023-01-01;3.0;Conference Paper;False;Marwa Faydi, Amira Zrelli, Tahar Ezzedine;ieee;False
85117847752;Analysis of IoT-based Smart Home Applications;2021-08-20;11.0;Conference Paper;False;Zixin Huang;ieee;False
85124125760;Edge Computing and Internet of Things Based Platform to Improve the Quality of Life of the Silver Economy on Leisure Cruise Ships;2021-01-01;8.0;Conference Paper;False;Marta Plaza-Hernandez, Ines Sitton-Candanedo, Ricardo S. Alonso, Luis C. Martinez-De Iturrate, Javier Prieto, Kalliopi Kravari, Theodoros Kosmanis, George Katranas, Miguel P. Silva, Juan M. Corchado;ieee;False
85172212180;Smart Cities: Transforming Urban Living with IoT;2023-01-01;2.0;Conference Paper;False;J. Niveditha, D. R. Kumar Raja, U. M. Ashwin Kumar;ieee;False
86000228358;Harnessing Transformative Potential of UAV-Based AI-Powered Data Analysis for Emission Monitoring;2024-01-01;0.0;Conference Paper;False;Mayank Namdev, Jay Dholaria, Meet Rathi;ieee;False
85180284125;Minimized Training of Machine Learning-Based Calibration Methods for Low-Cost O3Sensors;2024-02-01;5.0;Article;True;Stefano Tondini, Riccardo Scilla, Paolo Casari;ieee;False
85204971197;What is Peace Engineering?;2024-01-01;0.0;Conference Paper;False;Ramiro Jordan, Manel Martinez-Ramon, Donna Koechner, Kamil Agi;ieee;False
85192535967;IoT-Based Framework For Smart Agriculture;2024-01-01;0.0;Conference Paper;False;N. Hemanth Chandra, K. M. Soniya, J. Thriveni, K. R. Venugopal;ieee;False
