identifier;title;coverDate;citedCount;subtypeDescription;openaccessFlag;authors;origin;used
85090578172;The AirSensor open-source R-package and DataViewer web application for interpreting community data collected by low-cost sensor networks;2020-12-01;16.0;Article;True;Brandon Feenstra, Ashley Collier-Oxandale, Vasileios Papapostolou, David Cocker, Andrea Polidori;science_direct;True
85214338122;Gamification for air quality education: A systematic literature review;2025-02-15;3.0;Review;True;Abdollah Baghaei Daemei, Ruggiero Lovreglio, Zhenan Feng, Daniel Paes, Clayton Miller;science_direct;False
85141402908;Advancing exposure data analytics and repositories as part of the European Exposure Science Strategy 2020–2030;2022-12-01;10.0;Article;True;Marissa B. Kosnik, Stylianos Kephalopoulos, Amalia Muñoz, Nicolò Aurisano, Alberto Cusinato, Sani Dimitroulopoulou, Jaroslav Slobodnik, Jonathas De Mello, Maryam Zare Jeddi, Claudia Cascio, Andreas Ahrens, Yuri Bruinen de Bruin, Lothar Lieck, Peter Fantke;science_direct;False
85074642850;Adaptive spatial sampling design for environmental field prediction using low-cost sensing technologies;2020-01-15;15.0;Article;False;Eun Hye Yoo, Andrew Zammit-Mangion, Michael G. Chipeta;science_direct;False
85163784482;Towards air quality particulate-matter monitoring using low-cost sensor data and visual exploration techniques: Case study of Kisumu, Kenya;2022-01-01;7.0;Conference Paper;True;Stéphane C.K. Tékouabou, Jerôme Chenal, Rida Azmi, El Bachir Diop, Hamza Toulni, Antoine De Padoue Nsegbe;science_direct;False
105016841177;A novel integrated strategy for air quality monitoring in volcanic-hydrothermal, wetland, urban and industrial areas;2025-12-01;0.0;Article;True;R. Biagi, A. Randazzo, S. Venturi, F. Capecchiacci, O. Vaselli, F. Tassi;science_direct;False
85098673901;Biomass burning-derived airborne particulate matter in Southeast Asia: A critical review;2021-04-05;103.0;Article;False;Max G. Adam, Phuong T.M. Tran, Nanthi Bolan, Rajasekhar Balasubramanian;science_direct;False
85126313963;State-of-play in addressing urban environmental pressures: Mind the gaps;2022-06-01;7.0;Article;True;Charalampos Georgiadis, Petros Patias, Natalia Verde, Vassilios Tsioukas, Dimitris Kaimaris, Olga Georgoula, David Kocman, Eleni Athanasopoulou, Orestis Speyer, Astrid Raudner, Matthias Karl, Evangelos Gerasopoulos;science_direct;False
105009894865;Air pollution levels in South America;2025-01-01;0.0;Article;False;Néstor Y. Rojas, S. Enrique Puliafito, María Cazorla, Andrea Pineda-Rojas, Thiago Nogueira, Caroline Wikuats, Valeria Mardoñez-Balderrama, Marcos Andrade, Rodrigo Seguel, Jhojan Rojas;science_direct;False
85135449344;What if Air Quality Dictates Road Pricing? Simulation of an Air Pollution-based Road Charging Scheme;2022-12-01;7.0;Article;True;Sandro Rodriguez Garzon, Marcel Reppenhagen, Marcel Müller;science_direct;False
85090031993;On the linkage between urban heat island and urban pollution island: Three-decade literature review towards a conceptual framework;2021-01-10;406.0;Review;False;Giulia Ulpiani;science_direct;False
85093479136;Low-cost sensors for outdoor air quality monitoring;2019-01-01;24.0;Book Chapter;False;Michele Penza;science_direct;False
85076459304;Advances in sensing ammonia from agricultural sources;2020-03-01;103.0;Review;False;Matías Insausti, Roger Timmis, Rob Kinnersley, Mariana C. Rufino;science_direct;False
105018199834;Improving the Accuracy of Subway Mobile Laser Scanning Point Clouds Based on Target Constraints;2026-02-01;0.0;Article;False;Hao Liu, Hangbin Wu, Lianbi Yao, Kai Yi, Zhengwen Xu, Xiaobing Ding, Kun Yang;science_direct;False
85111708489;Are green roofs the path to clean air and low carbon cities?;2021-12-01;35.0;Article;False;S. Rafael, L. P. Correia, A. Ascenso, B. Augusto, D. Lopes, A. I. Miranda;science_direct;False
85202895097;Crowdsourcing applications for monitoring the urban environment;2024-01-01;2.0;Book Chapter;False;Mariana Vallejo Velázquez, Antigoni Faka, Ourania Kounadi;science_direct;True
105021079912;Open sensing: An interactive online tool for environmental data collection, monitoring, analysis, and modelling for custom environmental sensor devices;2025-12-01;0.0;Article;True;Carlos Sandoval Olascoaga, Khoi Ngo, Dezeng Kong, Leonard Schrage;science_direct;True
85210293600;How to improve the perceived health, comfort, and well-being of primary school teachers? A quantitative self-reported survey during the COVID-19 pandemic in Scotland;2024-12-20;0.0;Article;True;Natalie Bain-Reguis, Andrew Smith, Caroline Hollins-Martin, John Currie;science_direct;False
85159931512;Understanding the effect of temperature and relative humidity on sensor sensitivities in field environments and improving the calibration models of multiple electrochemical carbon monoxide (CO) sensors in a tropical environment;2023-09-01;19.0;Article;False;Rajitha Ariyaratne, M. A. Elangasinghe, M. Levy Zamora, D. G.G.P. Karunaratne, A. Manipura, K. B.S.N. Jinadasa, K. H.N. Abayalath;science_direct;False
85097873262;From Do-It-Yourself (DIY) to Do-It-Together (DIT): Reflections on designing a citizen-driven air quality monitoring framework in Taiwan;2021-03-01;52.0;Article;False;Sachit Mahajan, Cyuan Heng Luo, Dong Yi Wu, Ling Jyh Chen;science_direct;True
85191314984;Impact of COVID-19 on urban environment in developing countries: Case study and environmental sustainability strategy in Bangladesh;2024-05-01;13.0;Article;True;Md Sahidul Islam, Md Naimur Rahman, Negar Sultana Ritu, M. Safiur Rahman, Md Nazirul Islam Sarker;science_direct;False
85143913348;A parent-school initiative to assess and predict air quality around a heavily trafficked school;2023-02-25;7.0;Article;True;Prashant Kumar, Hamid Omidvarborna, Runming Yao;science_direct;True
105013670856;Low-Cost Source Apportionment (LoCoSA) of air pollution - literature review of the state of the art;2025-10-10;0.0;Review;True;Dimitrios Bousiotis, Lejla Ademi Shaqiri, Dylan S. Sanghera, Danielle Tinker, Francis D. Pope;science_direct;False
85212417350;Demonstrating multi-benefits of green infrastructure to schools through collaborative approach;2025-01-01;5.0;Article;True;K. V. Abhijith, Nidhi Rawat, Ana Paula Mendes Emygdio, Charlotte Le Den, Kate Collins, Paul Cartwright, Kate Alger, Ben McCallen, Prashant Kumar;science_direct;True
85173467038;Low-cost sensors and Machine Learning aid in identifying environmental factors affecting particulate matter emitted by household heating;2023-12-01;7.0;Article;True;Amirhossein Hassani, Sebastian Bykuć, Philipp Schneider, Paweł Zawadzki, Patryk Chaja, Núria Castell;science_direct;False
85141940222;Ambient characterisation of PurpleAir particulate matter monitors for measurements to be considered as indicative;2022-09-14;5.0;Article;True;Alexandre Caseiro, Seán Schmitz, Guillermo Villena, Janani Venkatraman Jagatha, Erika von Schneidemesser;science_direct;False
85083790059;Development of low-cost indoor air quality monitoring devices: Recent advancements;2020-07-20;176.0;Review;True;H. Chojer, P. T.B.S. Branco, F. G. Martins, M. C.M. Alvim-Ferraz, S. I.V. Sousa;science_direct;False
85109881954;“I am an air quality scientist”– Using citizen science to characterise school children's exposure to air pollution;2021-10-01;44.0;Article;False;Diana Varaden, Einar Leidland, Shanon Lim, Benjamin Barratt;science_direct;True
105002659049;Artificial intelligence in veterinary and animal science: applications, challenges, and future prospects;2025-08-01;4.0;Review;False;Navid Ghavi Hossein-Zadeh;science_direct;False
SCOPUS_ID:105018008852;Evolving trends in application of low-cost air quality sensor networks: challenges and future directions;2025-12-01;0.0;Review;True;Evangelos Bagkis, Amirhossein Hassani, Philipp Schneider, Priyanka DeSouza, Shobitha Shetty, Theodosios Kassandros, Vasileios Salamalikis, Núria Castell, Kostas Karatzas, Ajit Ahlawat, Jibran Khan;scopus;True
SCOPUS_ID:105014109517;Reassessing air pollution exposure: How daily mobility and activities shape individual risk in greater Paris;2025-12-01;0.0;Article;True;Taos Benoussaïd, Isabelle Coll, Hélène Charreire, Inès Makni, Malo Costes, Arthur Elessa Etuman;scopus;False
SCOPUS_ID:105006804685;Urban resilience through adaptive multifutures and nature-based solutions;2025-12-01;2.0;Note;True;Sachit Mahajan;scopus;False
SCOPUS_ID:105009051661;Using the pollution load index to evaluate rooftop harvested rainwater metal(loid) contamination in environmental justice communities;2025-11-01;1.0;Article;False;God'sgift N. Chukwuonye, Kunal Palawat, Robert A. Root, Luz Imelda Cortez, Theresa Foley, Victoria Carella, Charles Beck, Mónica D. Ramírez-Andreotta;scopus;False
SCOPUS_ID:105019683736;From Signal to Significance: Why Sensors Need Culture;2025-10-24;0.0;Review;False;Andrey V. Kalinichev;scopus;False
SCOPUS_ID:105016579618;Enhancing ATMO-Street model accuracy through emission source analysis using a dense sensor network: a Warsaw case study;2025-10-01;0.0;Article;True;Anahita Sattari, Hans Hooyberghs, Stijn Janssen, Aleksander Norowski, Lisa Blyth, Iwo Augustynski;scopus;False
SCOPUS_ID:105018917739;A Comprehensive Review of Data-Driven Techniques for Air Pollution Concentration Forecasting;2025-10-01;0.0;Review;True;Jaroslaw Bernacki, Rafał Scherer;scopus;False
SCOPUS_ID:105017121596;Sensortoolkit—A Python Library for Standardizing the Ingestion, Analysis, and Reporting of Air Sensor Data for Performance Evaluation;2025-09-01;0.0;Article;True;Menaka Kumar, Samuel G. Frederick, Karoline K. Barkjohn, Andrea L. Clements;scopus;True
SCOPUS_ID:105007769533;Advancements in air quality monitoring: a systematic review of IoT-based air quality monitoring and AI technologies;2025-09-01;2.0;Article;True;Antony Garcia, Yessica Saez, Itamar Harris, Xinming Huang, Edwin Collado;scopus;False
SCOPUS_ID:105008559096;Integrating perspectives: Multi-sectoral insights into U.S. Gulf Coast flood governance;2025-09-01;1.0;Article;False;Koorosh Azizi, Yuer Wang, Olivia Enriquez, Paola Passalacqua, Dev Niyogi, R. Patrick Bixler;scopus;False
SCOPUS_ID:105013799192;Air quality in Africa from the telecoupled perspective: exploring interdisciplinary and transboundary scientific collaboration between Africa and the Global North;2025-08-11;0.0;Review;True;Marleen Dekker, Agnieszka H. Kazimierczuk, Rebecca M. Garland, Deborah Stein-Zweers, Pieternel F. Levelt;scopus;False
SCOPUS_ID:105002303070;Assessing the impact of traffic restriction interventions on school air quality: a citizen science-based modelling study;2025-07-15;1.0;Article;True;Luca Boniardi, Federica Nobile, Massimo Stafoggia, Paola Michelozzi, Carla Ancona;scopus;True
SCOPUS_ID:105012163410;From Data to Discussion: Interfaces for Collective Inquiry and Open-Ended Data Creation;2025-07-05;0.0;Conference Paper;True;David Hunter;scopus;True
SCOPUS_ID:105002680589;Ten questions concerning the future of residential indoor air quality and its environmental justice implications;2025-06-15;3.0;Article;True;D. Booker, G. Petrou, L. Chatzidiakou, D. Das, F. Farooq, L. Ferguson, OE E.I. Jutila, K. Milczewska, M. Modlich, A. Moreno-Rangel, S. K. Thakrar, A. M. Yeoman, M. Davies, M. I. Mead, M. R. Miller, O. Wild, Z. Shi, A. Mavrogianni, R. M. Doherty;scopus;False
SCOPUS_ID:105009015886;A Wearable Sensor Node for Measuring Air Quality Through Citizen Science Approach: Insights from the SOCIO-BEE Project;2025-06-01;0.0;Article;True;Nicole Morresi, Maite Puerta-Beldarrain, Diego López-de-Ipiña, Alex Barco, Oihane Gómez-Carmona, Carlos López-Gomollon, Diego Casado-Mansilla, Maria Kotzagianni, Sara Casaccia, Sergi Udina, Gian Marco Revel;scopus;True
SCOPUS_ID:105008907848;Immersive, Secure, and Collaborative Air Quality Monitoring;2025-06-01;0.0;Review;True;José Marinho, Nuno Cid Martins;scopus;True
SCOPUS_ID:105007687912;Irish Perspectives on School Ambient Air Quality: A Design-Led Exploration;2025-06-01;0.0;Article;True;Áine de Róiste, Aoife Stack, Ganga Chinna Rao Devarapu, Liam O’Faolain, Mary Galvin;scopus;False
SCOPUS_ID:105006729860;Effects of Smoke on Surface Observations, Turbulence, and Proposed Subcritical Aerosol-Moisture Feedback (SAMF) During the 8 April 2024 Solar Eclipse in Columbus, GA, USA;2025-05-01;0.0;Article;True;Stephen M. Jessup, Britney Blaire Enfinger;scopus;False
SCOPUS_ID:105006739683;Development and Evaluation of the Online Hybrid Model CAMx-LPiG;2025-05-01;0.0;Article;True;Andrea Piccoli, Valentina Agresti, Giovanni Lonati, Guido Pirovano;scopus;False
SCOPUS_ID:85218037298;Unveiling the Dynamics of Human Mobility in Response to Wildfire-Induced Air Quality Degradation: An Examination of the 2019 Kincade Fire;2025-05-01;0.0;Article;False;Xianglu Shen, Huixin Zhang, Yanzhi Wang, Qi R. Wang;scopus;False
SCOPUS_ID:105003896518;Identifying air quality monitoring deserts in the United States;2025-04-29;1.0;Article;True;Nelson A. Roque, Hailey Andrews, Alexis R. Santos-Lozada;scopus;False
SCOPUS_ID:105003698856;Measurement report: A complex street-level air quality observation campaign in a heavy-traffic area utilizing the multivariate adaptive regression splines method for field calibration of low-cost sensors;2025-04-24;0.0;Article;True;Petra Bauerová, Josef Keder, Adriana Šindelářová, Ondřej Vlček, William Patiño, Pavel Krč, Jan Geletič, Hynek Řezníček, Martin Bureš, Kryštof Eben, Michal Belda, Jelena Radović, Vladimír Fuka, Radek Jareš, Igor Esau, Jaroslav Resler;scopus;False
SCOPUS_ID:105001275004;Detecting air pollution episodes and exploring their impacts using low-cost sensor data and simultaneous community symptom and odor reports;2025-04-01;2.0;Article;True;Caroline Frischmon, Jennifer Crosslin, Leah Burks, Barbara Weckesser, Michael Hannigan, Katharine Duderstadt;scopus;True
SCOPUS_ID:105003373888;Leveraging low-cost sensors to predict nitrogen dioxide for epidemiologic exposure assessment;2025-04-01;3.0;Article;False;Christopher Zuidema, Jianzhao Bi, Dustin Burnham, Nancy Carmona, Amanda J. Gassett, David L. Slager, Cooper Schumacher, Elena Austin, Edmund Seto, Adam A. Szpiro, Lianne Sheppard;scopus;False
SCOPUS_ID:85216814154;Augmenting Circadian Biology Research With Data Science;2025-04-01;0.0;Review;False;Severine Soltani, Jamison H. Burks, Benjamin L. Smarr;scopus;False
SCOPUS_ID:85219671627;Particulate matter concentrations in UK schools: A nationwide study into the influence of ambient PM2.5 and the resulting exposure potentials;2025-03-20;0.0;Article;False;Alice E.E. Handy, Samuel G.A. Wood, Katherine Roberts, Christopher S. Malley, Henry C. Burridge;scopus;False
SCOPUS_ID:105005918833;Connected services: IoT data to fuel your local digital twin;2025-03-08;0.0;Book Chapter;True;Lieven Raes, Burcu Celikkol, Oliver Schreer, Jaap De Winter, Jéssica Baltazar, Susie Ruston McAleer, Daniel Bertocci;scopus;False
SCOPUS_ID:105001094350;Implementation of an Internet of Things Architecture to Monitor Indoor Air Quality: A Case Study During Sleep Periods;2025-03-01;2.0;Article;True;Afonso Mota, Carlos Serôdio, Ana Briga-Sá, Antonio Valente;scopus;False
SCOPUS_ID:85218911746;Developing a real-time water quality simulation toolbox using machine learning and application programming interface;2025-03-01;1.0;Article;False;Gi Hun Bang, Na Hyeon Gwon, Min Jeong Cho, Ji Ye Park, Sang Soo Baek;scopus;False
SCOPUS_ID:85219206069;A Systematic Study of Popular Software Packages and AI/ML Models for Calibrating In Situ Air Quality Data: An Example with Purple Air Sensors;2025-02-01;2.0;Article;True;Seren Smith, Theodore Trefonides, Anusha Srirenganathan Malarvizhi, Shyra LaGarde, Jiakang Liu, Xiaoguo Jia, Zifu Wang, Jacob Cain, Thomas Huang, Mohammad Pourhomayoun, Grace Llewellyn, Wai Phyo, Sina Hasheminassab, Joe Roberts, Kevin Marlis, Daniel Q. Duffy, Chaowei Yang;scopus;False
SCOPUS_ID:85201981944;Behavioral Responses to Wildfire Smoke: A Case Study in Western Montana;2025-02-01;3.0;Article;False;Taylor Stewart, Alison Monroe, Katrina Mullan, Dave Jones, Abby McIver, Ethan S. Walker;scopus;False
SCOPUS_ID:85214239096;The Effect of Wildfires on Asthma and Allergies;2025-02-01;5.0;Article;False;John R. Balmes, Anne Hicks, Mary M. Johnson, Kari C. Nadeau;scopus;False
SCOPUS_ID:85211718095;Understanding the origins of urban particulate matter pollution based on high-density vehicle-based sensor monitoring and big data analysis;2025-02-01;2.0;Article;False;Yiheng Liang, Xiaohua Wang, Zhongzhen Dong, Xinfeng Wang, Shidong Wang, Shuchun Si, Jing Wang, Hai Ying Liu, Qingzhu Zhang, Qiao Wang;scopus;False
SCOPUS_ID:85217277579;Radioactive contamination transported to Western Europe with Saharan dust;2025-01-31;1.0;Article;True;Yangjunjie Xu-Yang, Charlotte Skonieczny, Sophie Ayrault, Jean Sébastien Barbier, Rémi Bizeul, Octave Bryskere, Pierre Alexis Chaboche, Thomas Chalaux-Clergue, José A. Corcho-Alvarado, Anthony Foucher, Alice Karsenti, Maxime Leblanc, Germán Orizaola, Amélie Plautre, Stefan Röllin, Nirina Taraconat, Nicolas Tenaud, Ana Elisa Valdés, François Dulac, Olivier Evrard;scopus;False
SCOPUS_ID:85189912679;What improves students’ participation in a school-based citizen science project? Through the lens of practitioners;2025-01-01;7.0;Article;False;Yenchun Jim Wu, Wan Ju Hsu;scopus;False
SCOPUS_ID:105001958511;Air quality monitoring platform with multiple data source support;2025-01-01;1.0;Article;False;Dessislava Petrova-Antonova, Jelyazko Jelyazkov, Irena Pavlova;scopus;False
SCOPUS_ID:105003424083;A nationwide evaluation of crowd-sourced ambient temperature data;2025-01-01;2.0;Article;True;Priyanka deSouza, Peter C. Ibsen, Daniel M. Westervelt, Ralph Kahn, Benjamin F. Zaitchik, Patrick L. Kinney;scopus;False
SCOPUS_ID:105007806566;Enhancing Public Awareness of Air Quality: Evaluating Communication Strategies and Design Prototypes Using a Design-Based Implementation Research Approach;2025-01-01;0.0;Conference Paper;False;Victoria Batz, Vanessa B. Liedtke, Petre Lameski, Vladimir Trajkovik, Steffi Hußlein, Christian Hansen, Michael A. Herzog;scopus;True
SCOPUS_ID:105012291762;Impact of Adverse Events on Urban Air Quality: the Example of the Rome Fire;2025-01-01;0.0;Article;False;Nicoletta Lotrecchiano, Daniele Sofia;scopus;False
SCOPUS_ID:105003973618;Empowering Communities In Transformative Transport Decision-making: A Participatory Spatial Approach to Select Vulnerable Facilities for Citizen Sensing;2025-01-01;1.0;Article;True;Nadia Giuffrida, Michela Le Pira;scopus;True
SCOPUS_ID:105019219460;“We have the right to breathe clean air” – Mobilising communities in the fight for good air quality;2025-01-01;0.0;Article;True;Katarzyna Gorczyca, Daria Zozulia;scopus;False
SCOPUS_ID:105017827962;How Do People Perceive Air Quality in Different Geographic Contexts? A Case Study of Hong Kong, China;2025-01-01;0.0;Article;False;Wanying Song, Mei Po Kwan;scopus;False
SCOPUS_ID:105019165467;Fundamentals of Air Pollution;2025-01-01;1.0;Book;False;Daniel A. Vallero;scopus;False
SCOPUS_ID:85211116070;Field calibration of fine particulate matter low-cost sensors in a highly industrialized semi-arid conurbation;2024-12-01;2.0;Article;True;Mariana Villarreal-Marines, Michael Pérez-Rodríguez, Yasmany Mancilla, Gabriela Ortiz, Alberto Mendoza;scopus;False
SCOPUS_ID:85211101445;Air quality and transport behaviour: sensors, field, and survey data from Warsaw, Poland;2024-12-01;1.0;Data Paper;True;Amirhossein Hassani, Anna Nicińska, Arkadiusz Drabicki, Ewa Zawojska, Gabriela Sousa Santos, Grzegorz Kula, Henrik Grythe, Jakub Zawieska, Joanna Jaczewska, Joanna Rachubik, Katarzyna Archanowicz-Kudelska, Katarzyna Zagórska, Maciej Grzenda, Magdalena Kubecka, Marcin Luckner, Michał Jakubczyk, Michał Wolański, Nuria Castell, Paweł Gora, Pål Wilter Skedsmo, Satia Rożynek, Szymon Horosiewicz;scopus;False
SCOPUS_ID:85185267678;What is the role of activism in air pollution politics? Understanding policy change in Poland;2024-12-01;8.0;Article;True;Tomas Maltby, Sarah Birch, Adam Fagan, Mate Subašić;scopus;False
SCOPUS_ID:85207906875;Differences in Changes of Mobility Patterns Across the Globe—Evidence From a Natural Experiment;2024-12-01;2.0;Article;True;Joanna A. Kamińska, Jan K. Kazak;scopus;False
SCOPUS_ID:85184391500;Clearing the air: evaluating institutions’ social media health messaging on wildfire and smoke risks in the US Pacific Northwest;2024-12-01;4.0;Article;True;Catherine E. Slavik, Daniel A. Chapman, Alex Segrè Cohen, Nahla Bendefaa, Ellen Peters;scopus;False
SCOPUS_ID:85209191716;Spatio-temporal analysis of bicyclists’ PM2.5 exposure levels in a medium sized urban agglomeration;2024-12-01;1.0;Article;False;María Florencia Tames, Salvador Enrique Puliafito, Josefina Urquiza, Ariel Fabricio Scagliotti, Ana Isabel López-Noreña;scopus;False
SCOPUS_ID:85202581640;A comprehensive review on advancements in sensors for air pollution applications;2024-11-15;63.0;Review;False;Thara Seesaard, Kamonrat Kamjornkittikoon, Chatchawal Wongchoosuk;scopus;False
SCOPUS_ID:85209133987;Navigating the cohesion-diversity trade-off: understanding the role of facilitators in co-creation using agent-based modelling;2024-11-13;2.0;Article;True;Sachit Mahajan;scopus;False
SCOPUS_ID:85189953434;Monitoring Groundwater Health Using Citizen Scientists in Semi-Arid Regional Australia;2024-11-01;2.0;Article;True;Kathryn L. Korbel, Grant C. Hose;scopus;False
SCOPUS_ID:85211168546;Hydrodynamics and Aquatic Vegetation Drive Spatial Patterns of Environmental DNA in Ponds;2024-11-01;5.0;Article;True;Sandra R. Mayne, Jeffrey A. Manning, Stephen M. Henderson, Meghan B. Parsley, Katherine M. Strickler, Jeffrey R. Nielson, Caren S. Goldberg;scopus;False
SCOPUS_ID:85199025902;A 13-year space-based climatological evolution of desert dust aerosols in the Middle East and North Africa regions observed by the CALIPSO;2024-10-20;6.0;Article;False;Samuel Abraham Berhane, Kanike Raghavendra Kumar, Lingbing Bu;scopus;False
SCOPUS_ID:85206461343;An Image-Based Sensor System for Low-Cost Airborne Particle Detection in Citizen Science Air Quality Monitoring;2024-10-01;4.0;Article;True;Syed Mohsin Ali Shah, Diego Casado-Mansilla, Diego López-de-Ipiña;scopus;False
SCOPUS_ID:85196723829;Effects of perceived environmental quality and psychological status on outdoor thermal comfort: a panel study in Southern China;2024-10-01;19.0;Article;False;Cho Kwong Charlie Lam, Haonan Pan, Weixiao Nie, Xiaohui Li, Jie Wu, Zhe Yin, Jiejie Han;scopus;False
SCOPUS_ID:85196863937;Validation of cheap axial passive sampler and procedure suitable for atmospheric NO2 community-based monitoring;2024-09-01;0.0;Article;True;Alma Moretta, Daniele Sofia, Maria Ricciardi, Vincenzo Venditto, Antonio Proto;scopus;True
SCOPUS_ID:85194760749;Atmospheric concentrations and potential sources of dioxin-like contaminants to Acadia National Park;2024-09-01;1.0;Article;False;James J. Pagano, Andrew J. Garner, Philip K. Hopke, Justin K. Pagano, William G. Gawley, Thomas M. Holsen;scopus;False
SCOPUS_ID:85203866198;Feasibility Study on the Use of NO2 and PM2.5 Sensors for Exposure Assessment and Indoor Source Apportionment at Fixed Locations;2024-09-01;3.0;Article;True;Miriam Chacón-Mateos, Erika Remy, Uta Liebers, Frank Heimann, Christian Witt, Ulrich Vogt;scopus;False
SCOPUS_ID:85202605583;Examining Relationships between Perceptions of Air Quality—Objectively Assessed Particulate Matter—And Health-Related Attributions among Midlife and Older Adults from the San Francisco Bay Area, California, USA;2024-08-01;2.0;Article;True;Astrid N. Zamora, Maria I. Campero, Dulce M. Garcia, Abby C. King;scopus;False
SCOPUS_ID:85199590093;Exploring the Spatial Variability of Air Pollution Using Mobile BC Measurements in a Citizen Science Project: A Case Study in Mechelen;2024-07-01;2.0;Article;True;Martine Van Poppel, Jan Peters, Stijn Vranckx, Jo Van Laer, Jelle Hofman, Bram Vandeninden, Charlotte Vanpoucke, Wouter Lefebvre;scopus;True
SCOPUS_ID:85194815051;Rational gaze: Presenting the open-source HYPEtools R package for analysis, visualization, and interpretation of hydrological models and datasets;2024-07-01;3.0;Article;True;Conrad Brendel, René Capell, Alena Bartosova;scopus;False
SCOPUS_ID:85193068324;Adapting machine learning for environmental spatial data - A review;2024-07-01;22.0;Review;True;Marta Jemeļjanova, Alexander Kmoch, Evelyn Uuemaa;scopus;False
SCOPUS_ID:85201468828;The societal impact of Open Science: A scoping review;2024-06-27;15.0;Review;True;Nicki Lisa Cole, Eva Kormann, Thomas Klebel, Simon Apartis, Tony Ross-Hellauer;scopus;False
SCOPUS_ID:85197427049;Long-term evaluation of commercial air quality sensors: an overview from the QUANT (Quantification of Utility of Atmospheric Network Technologies) study;2024-06-26;12.0;Article;True;Sebastian Diez, Stuart Lacy, Hugh Coe, Josefina Urquiza, Max Priestman, Michael Flynn, Nicholas Marsden, Nicholas A. Martin, Stefan Gillott, Thomas Bannan, Pete M. Edwards;scopus;False
SCOPUS_ID:85192253990;Long-term variation in exposure to NO2 concentrations in the city of Naples, Italy: Results of a citizen science project;2024-06-25;2.0;Article;True;Elena Chianese, Angelo Riccio;scopus;False
SCOPUS_ID:85194769987;Blockchain and IoT integration for secure short-term and long-term air quality monitoring system using optimized neural network;2024-06-01;4.0;Article;False;Balasubramanian Chinnappan, Kareemullah Hakim, Neelam Sanjeev Kumar, Vijayalakshmi Elumalai;scopus;False
SCOPUS_ID:85189751439;Dynamic and stationary monitoring of air pollutant exposures and dose during marathons;2024-06-01;3.0;Article;True;Carla Ribalta, Fréderic Garrandes, Stéphane Bermon, Paolo Emilio Adami, Edurne Ibarrola-Ulzurrun, Ioar Rivas, Mar Viana;scopus;False
