identifier;title;coverDate;citedCount;subtypeDescription;openaccessFlag;authors;origin;used
SCOPUS_ID:85193289690;Advancing air quality monitoring: A low-cost sensor network in motion – Part I;2024-06-01;1.0;Article;False;Carolina Correia, Pedro Santana, Vânia Martins, Pedro Mariano, Alexandre Almeida, Susana Marta Almeida;scopus;False
SCOPUS_ID:85194859559;Evaluating ActuAir: Building Occupants' Experiences of a Shape-Changing Air Quality Display;2024-05-11;2.0;Conference Paper;True;Eleni Margariti, Vasilis Vlachokyriakos, Abigail C. Durrant, David Kirk;scopus;True
SCOPUS_ID:85193979071;Street-scale air quality modelling over the West Midlands, United Kingdom: Effect of idealised traffic reduction scenarios;2024-05-01;5.0;Article;True;Jian Zhong, Jenny Stocker, Xiaoming Cai, Roy M. Harrison, William James Bloss;scopus;False
SCOPUS_ID:85188955262;Citizen monitoring in environmental disclosure: An economics perspective;2024-04-01;2.0;Article;True;Per M. Stromberg, Ranjula Bali Swain;scopus;False
SCOPUS_ID:85187872693;Data Linkages for Wildfire Exposures and Human Health Studies: A Scoping Review;2024-03-01;4.0;Review;True;J. Barkoski, E. Van Fleet, A. Liu, S. Ramsey, R. K. Kwok, A. K. Miller;scopus;False
SCOPUS_ID:85185917442;Bridging research-policy gaps An integrated approach;2024-02-17;9.0;Review;True;Kenza Khomsi, Houria Bouzghiba, Abderrahmane Mendyl, Ahmed K. Al-Delaimy, Amal Dahri, Amal Saad-Hussein, Ghada Balaw, Ihssane El Marouani, Imane Sekmoudi, Mouaad Adarbaz, Narges Khanjani, Nivine Abbas;scopus;False
SCOPUS_ID:85194142089;Dynamic Exposure Visualization of Air Quality Data with Augmented Reality;2024-01-01;2.0;Conference Paper;True;Sylvain Renault, Ingo Feldmann, Lieven Raes, Jurgen Silence, Oliver Schreer;scopus;False
SCOPUS_ID:85214919883;Addressing Environmental Quality Inequities: The Role of Information and Collective Action;2024-01-01;1.0;Book Chapter;False;Sandra Aguilar-Gomez;scopus;True
SCOPUS_ID:85200496043;Scalable, Low-Cost, and Versatile System Design for Air Pollution and Traffic Density Monitoring and Analysis;2024-01-01;0.0;Book Chapter;True;Thinh Gia Tran, Dat T. Vo, Long C. Tran, Hoang V. Pham, Chuong D. Le, An D. Le, Duy A. Pham, Hien B. Vo;scopus;True
SCOPUS_ID:85188327378;Conscious walk assessment for the joint evaluation of the soundscape, air quality, biodiversity, and comfort in Barcelona;2024-01-01;2.0;Article;True;Rosa Ma Alsina-Pagès, Ma Eulàlia Parés, Ester Vidaña-Vila, Marc Freixes, Danielly Garcia, Marc Arnela, Carmen Martínez-Suquía, Oriol Serra, Mariona Ferrandiz-Rovira;scopus;False
SCOPUS_ID:85199386918;Applying Digital Technology to Understand Human Experiences of Climate Change Impacts on Food Security and Mental Health: Scoping Review;2024-01-01;5.0;Review;True;Jasmin Bhawra, Nadine Elsahli, Jamin Patel;scopus;False
SCOPUS_ID:85190378164;Localizing the sustainable development goals in smart and sustainable cities: how can citizen-generated data support the local monitoring of SDGs? A case study of the Brussels Capital Region;2024-01-01;4.0;Article;True;Koen Borghys, Laurens Vandercruysse, Carina Veeckman, Laura Temmerman, Rob Heyman;scopus;False
SCOPUS_ID:85209541146;Adaptive Air Monitoring with a Combination of Solar Glider and Drone;2024-01-01;0.0;Conference Paper;False;Martin Zagar, Mateo Sokac, Stasa Puskaric;scopus;False
SCOPUS_ID:85201268432;A situational ethics and harmonization challenges in the case of EU biodiversity data governance;2024-01-01;0.0;Article;True;Bartosz Ślosarski, Natalia Juchniewicz;scopus;False
SCOPUS_ID:85206134259;The sphere of exposure: centering user experience in community science air monitoring;2024-01-01;1.0;Article;True;Marisa Westbrook, Valentina Serrano-Salomón, Jay Pecenka, Sumit Sankhyan, Aniya K. Hollo, Shelly L. Miller, Esther Sullivan;scopus;True
SCOPUS_ID:85183974976;Crowdsourcing Geospatial Data for Earth and Human Observations: A Review;2024-01-01;28.0;Review;True;Xiao Huang, Siqin Wang, Di Yang, Tao Hu, Meixu Chen, Mengxi Zhang, Guiming Zhang, Filip Biljecki, Tianjun Lu, Lei Zou, Connor Y.H. Wu, Yoo Min Park, Xiao Li, Yunzhe Liu, Hongchao Fan, Jessica Mitchell, Zhenlong Li, Alexander Hohl;scopus;False
SCOPUS_ID:86000671805;Development of Real Time Meteorological Grade Monitoring Stations with AI Analytics;2024-01-01;0.0;Article;True;Adrian Kok Eng Hock, Chan Yee Kit, Koo Voon Chet;scopus;False
SCOPUS_ID:85216210186;Microcontroller system for air quality monitoring;2024-01-01;0.0;Conference Paper;False;Tetiana Hovorushchenko, Vyacheslav Bachuk, Vladyslav Sevostyanov, Andrii Martsenyuk, Houda El Bouhissi;scopus;False
SCOPUS_ID:85192176988;Targeting disparate spaces: new technology and old tools;2024-01-01;0.0;Article;True;Morgan M. Richey, John Bang, Vijay Sivaraman;scopus;False
SCOPUS_ID:85212288756;Policies and Regulations for Sustainable Clean Air: An Overview;2024-01-01;3.0;Book Chapter;False;Hanadi G. Al-Thani, Rima J. Isaifan;scopus;False
SCOPUS_ID:85192185379;Activism in the era of democratic backsliding: explaining the efficacy of the clean-air campaigns in Poland;2024-01-01;3.0;Article;True;Mate Subašić, Sarah Birch, Adam Fagan, Tomas Maltby;scopus;False
SCOPUS_ID:85165249207;Estimation of rainfall and streamflow missing data under uncertainty for Nile basin headwaters: the case of Ghba catchments;2024-01-01;3.0;Article;True;Mehari Gebreyohannes Hiben, Admasu Gebeyehu Awoke, Abraha Adugna Ashenafi;scopus;False
SCOPUS_ID:85179151323;“I have to stay inside …”: Experiences of air pollution for people with asthma;2024-01-01;5.0;Article;True;Amy McCarron, Sean Semple, Vivien Swanson, Christine F. Braban, Colin Gillespie, Heather D. Price;scopus;False
SCOPUS_ID:85191352291;Communicating particulate matter risk: the effects of empoweredness and trust in government information on protective behaviour;2024-01-01;3.0;Article;False;Joohee Lee, Soeun Yang, Chris A.B. Zajchowski, Hana Kim;scopus;False
SCOPUS_ID:85173114436;Long-range transport and microscopy analysis of Sangay volcanic ashes in Ecuador;2024-01-01;5.0;Article;True;Daniel Moran-Zuloaga, Wilson Merchan-Merchan, Emilio Rodriguez-Caballero, Maurizio Mulas, Philip Hernick;scopus;False
SCOPUS_ID:85212290976;Promoting Behavioral Change and Public Awareness for Sustainable Clean Air;2024-01-01;0.0;Book Chapter;False;Onah Peter Thompson, Reagan S. Breitenstein, Brendon R. Barnes, Richard Glory;scopus;False
SCOPUS_ID:85200236234;The nexus of transportation, the built environment, air pollution and health;2024-01-01;2.0;Review;True;Haneen Khreis, Harry Williams, Seyed Sajjad Abdollahpour, Matilda van den Bosch, Pierpaolo Mudu, Marko Tainio, Age Poom, Soheil Sohrabi, Steve Hankey;scopus;False
SCOPUS_ID:85202215041;Spatio-Temporal Models for Ecologists;2024-01-01;9.0;Book;False;James T. Thorson, Kasper Kristensen;scopus;False
SCOPUS_ID:85208720664;Aerosol Atmospheric Rivers: Availability, Spatiotemporal Characterisation, Predictability, and Impacts;2024-01-01;2.0;Book;False;Manish Kumar Goyal, Kuldeep Singh Rautela;scopus;False
SCOPUS_ID:85178094584;Machine learning to support citizen science in urban environmental management;2023-12-01;2.0;Article;True;Emily J. Yang, Julian Fulton, Swabinash Swarnaraja, Cecile Carson;scopus;True
SCOPUS_ID:85165614752;Air pollution prediction system using XRSTH-LSTM algorithm;2023-12-01;5.0;Article;False;Harshit Srivastava, Santos Kumar Das;scopus;False
SCOPUS_ID:85180355366;An Assessment Model for Sustainable Cities Using Crowdsourced Data Based on General System Theory: A Design Science Methodology Approach;2023-12-01;9.0;Article;True;Usman Ependi, Adian Fatchur Rochim, Adi Wibowo;scopus;False
SCOPUS_ID:85180679038;Classifying Crowdsourced Citizen Complaints through Data Mining: Accuracy Testing of k-Nearest Neighbors, Random Forest, Support Vector Machine, and AdaBoost;2023-12-01;7.0;Article;True;Evaristus D. Madyatmadja, Corinthias P.M. Sianipar, Cristofer Wijaya, David J.M. Sembiring;scopus;False
SCOPUS_ID:85185223833;Research progress, challenges, and prospects of PM2.5 concentration estimation using satellite data;2023-12-01;18.0;Article;True;Shoutao Zhu, Jiayi Tang, Xiaolu Zhou, Peng Li, Zelin Liu, Cicheng Zhang, Ziying Zou, Tong Li, Changhui Peng;scopus;False
SCOPUS_ID:85173286812;A cross-sectional study of inequalities in digital air pollution information access and exposure reducing behavior uptake in the UK;2023-11-01;5.0;Article;True;Kayla Schulte, Ben Hudson;scopus;True
SCOPUS_ID:85169074909;Air Quality Monitoring in Coal-Centric Cities: A Hybrid Approach;2023-08-01;3.0;Article;True;Simone Mora, Priyanka deSouza, Fábio Duarte, An Wang, Sanjana Paul, Antonio Berrones, Carlo Ratti;scopus;False
SCOPUS_ID:85166193000;Design and Implementation of a Crowdsensing-Based Air Quality Monitoring Open and FAIR Data Infrastructure;2023-07-01;6.0;Article;True;Paolo Diviacco, Massimiliano Iurcev, Rodrigo José Carbajales, Alberto Viola, Nikolas Potleca;scopus;True
SCOPUS_ID:85153102750;Western Balkan societies' awareness of air pollution. Estimations using natural language processing techniques;2023-07-01;7.0;Article;False;Angela Madjar, Ivana Gjorshoska, Jana Prodanova, Aleksandra Dedinec, Ljupco Kocarev;scopus;True
SCOPUS_ID:85160010856;Democracy by Design: Perspectives for Digitally Assisted, Participatory Upgrades of Society;2023-07-01;66.0;Article;True;Dirk Helbing, Sachit Mahajan, Regula Hänggli Fricker, Andrea Musso, Carina I. Hausladen, Cesare Carissimo, Dino Carpentras, Elisabeth Stockinger, Javier Argota Sanchez-Vaquerizo, Joshua C. Yang, Mark C. Ballandies, Marcin Korecki, Rohit K. Dubey, Evangelos Pournaras;scopus;False
SCOPUS_ID:85162170013;VOLUNTEERED GEOGRAPHIC INFORMATION FOR MAPPING URBAN CLIMATE AND AIR QUALITY: TESTING AND ASSESSING ‘SNIFFER BIKES’ WITH LOW-COST SENSORS;2023-05-25;3.0;Conference Paper;True;C. Zanetti, M. Carraro, M. De Marchi, S. E. Pappalardo;scopus;False
SCOPUS_ID:85133073312;Public engagement with air quality data: using health behaviour change theory to support exposure-minimising behaviours;2023-05-01;43.0;Article;True;Amy McCarron, Sean Semple, Christine F. Braban, Vivien Swanson, Colin Gillespie, Heather D. Price;scopus;False
SCOPUS_ID:85143910632;Personal exposure monitoring using GPS-enabled portable air pollution sensors: A strategy to promote citizen awareness and behavioral changes regarding indoor and outdoor air pollution;2023-05-01;36.0;Article;False;Yoo Min Park, Denise Chavez, Sinan Sousan, Natalia Figueroa-Bernal, Jenifer Rodríguez Alvarez, Juvencio Rocha-Peralta;scopus;False
SCOPUS_ID:85152313791;From Raising Awareness to a Behavioural Change: A Case Study of Indoor Air Quality Improvement Using IoT and COM-B Model;2023-04-01;15.0;Article;True;Rameez Raja Kureshi, Dhavalkumar Thakker, Bhupesh Kumar Mishra, Jo Barnes;scopus;False
SCOPUS_ID:85152553772;Data Quality in IoT-Based Air Quality Monitoring Systems: a Systematic Mapping Study;2023-04-01;41.0;Review;True;Julio Buelvas, Danny Múnera, Diana P. Tobón V, Johnny Aguirre, Natalia Gaviria;scopus;False
SCOPUS_ID:85146938130;A performance comparison study on PM2.5 prediction at industrial areas using different training algorithms of feedforward-backpropagation neural network (FBNN);2023-03-01;29.0;Article;False;Pavithra Chinatamby, Jegalakshimi Jewaratnam;scopus;False
SCOPUS_ID:85143703058;Who should measure air quality in modern cities? The example of decentralization of urban air quality monitoring in Krasnoyarsk (Siberia, Russia);2023-02-01;9.0;Article;True;Lev D. Labzovskii, Joshua Vande Hey, Aleksey A. Romanov, Polina Golovatina-Mora, Dmitriy Belikov, Azam Lashkari, Samuel Takele Kenea, Erik Hekman;scopus;False
SCOPUS_ID:85148970810;Sensors Network as an Added Value for the Characterization of Spatial and Temporal Air Quality Patterns at the Urban Scale;2023-02-01;7.0;Article;True;Daniel Graça, Johnny Reis, Carla Gama, Alexandra Monteiro, Vera Rodrigues, Micael Rebelo, Carlos Borrego, Myriam Lopes, Ana Isabel Miranda;scopus;False
SCOPUS_ID:85149028071;Design Considerations for a Distributed Low-Cost Air Quality Sensing System for Urban Environments in Low-Resource Settings;2023-02-01;20.0;Article;True;Engineer Bainomugisha, Joel Ssematimba, Deo Okure;scopus;False
SCOPUS_ID:85149032662;A Low-Cost Calibration Method for Temperature, Relative Humidity, and Carbon Dioxide Sensors Used in Air Quality Monitoring Systems;2023-02-01;24.0;Article;True;Rosa Amalia González Rivero, Luis Ernesto Morera Hernández, Olivier Schalm, Erik Hernández Rodríguez, Daniellys Alejo Sánchez, Mayra C. Morales Pérez, Vladimir Nuñez Caraballo, Werner Jacobs, Alain Martinez Laguardia;scopus;False
SCOPUS_ID:85153863884;Integrating Citizen Science into the Work of United States Environmental Agencies;2023-01-01;3.0;Article;True;George Wyeth;scopus;False
SCOPUS_ID:85182422118;A framework for making citizen science inclusive with storytelling methods;2023-01-01;4.0;Article;True;C. Veeckman, S. Claes, L. Van Audenhove, S. van der Graaf;scopus;False
SCOPUS_ID:85138320343;A critical air quality science perspective on citizen science in action;2023-01-01;11.0;Article;True;Douglas Booker, Gordon Walker, Paul J. Young, Ana Porroche-Escudero;scopus;False
SCOPUS_ID:85188475271;Monitoring invasive macroalgae in southern Portugal: drivers and citizen science contribution;2023-01-01;6.0;Article;True;Javier Jiménez Herrero, Dina Costa Simes, Rita Abecasis, Paulo Relvas, Erwan Garel, Paula Ventura Martins, Rui Santos;scopus;False
SCOPUS_ID:85178424452;Air Pollution Crisis Across Europe: The European Courts, the Governments, the Citizens and the Persistent Ineffectiveness of EU Law;2023-01-01;2.0;Article;True;Kleoniki Pouikli, Ariti Tsoukala;scopus;False
SCOPUS_ID:85169015962;A Framework for Monitoring and Identifying Indoor Air Pollutants Based on BIM with IoT Sensors;2023-01-01;1.0;Conference Paper;False;Jihoon Chung, Alexandros Tsamis, Dennis Shelden;scopus;False
SCOPUS_ID:85177495352;In Search of a “Social-AQI” Democratic Deficits in the Air Pollution Data Regime in Delhi;2023-01-01;3.0;Article;True;Ruchi Dwivedi, Muzamil Yaqoob, Aasim Khan, Praveen Priyadarshi, Saad Ahmad, Sudhir Attri, Raghava Mutharaju;scopus;False
SCOPUS_ID:85183852492;Towards Fine-Grained Sensor-Based Probabilistic Individual Air Pollution Exposure Prediction using Wind Information;2023-01-01;0.0;Conference Paper;False;Paul Tremper, Till Riedel;scopus;False
SCOPUS_ID:85180595192;Environmental Data Sensing Through Participatory Urbanism. A Best-Practice Analysis and City-Administration Perspective;2023-01-01;0.0;Article;True;Gerfried Mikusch, Andreas Petz, Elisabeth Steiner, Momir Tabakovic, Hilda Tellioglu;scopus;False
SCOPUS_ID:85204090205;Community-driven research and capacity building to address environmental justice concerns with industrial air pollution in Curtis Bay, South Baltimore;2023-01-01;4.0;Article;True;Matthew A. Aubourg, Greg Sawtell, Lauren Deanes, Nicole Fabricant, Meleny Thomas, Kristoffer Spicer, Caila Wagar, Shashawnda Campbell, Abigail Ulman, Christopher D. Heaney;scopus;False
SCOPUS_ID:85149637659;Bilateral impact of digital economy on air pollution: Emissions increase and reduction effects;2023-01-01;16.0;Article;True;Ruomei Wang, Chenhui Ding;scopus;False
SCOPUS_ID:85179276226;Unraveling Environmental Disasters;2023-01-01;3.0;Book;False;Daniel A. Vallero, Trevor M. Letcher;scopus;False
SCOPUS_ID:85151815356;Following SEIS principles for better FAIR data integration in EOSC;2022-12-29;0.0;Book Chapter;False;Enrique Wulff;scopus;False
SCOPUS_ID:85128304603;Translating citizen-generated air quality data into evidence for shaping policy;2022-12-01;45.0;Review;True;Sachit Mahajan, Ming Kuang Chung, Jenny Martinez, Yris Olaya, Dirk Helbing, Ling Jyh Chen;scopus;True
SCOPUS_ID:85133906650;A process for creating data report-back tools to improve equity in environmental health;2022-12-01;7.0;Article;True;Kathryn S. Tomsho, Erin Polka, Stacey Chacker, David Queeley, Marty Alvarez, Madeleine K. Scammell, Karen M. Emmons, Rima E. Rudd, Gary Adamkiewicz;scopus;True
SCOPUS_ID:85136467402;Design and development of an open-source framework for citizen-centric environmental monitoring and data analysis;2022-12-01;29.0;Article;True;Sachit Mahajan;scopus;True
SCOPUS_ID:85138328903;The spatiotemporal dynamics, distribution, and characteristics of beached plastics along the remote south coast of Western Australia;2022-11-01;5.0;Article;False;Chao Lyu, Harriet Louise Paterson, James Fogarty;scopus;False
SCOPUS_ID:85140831170;Farmers and Local Residents Collaborate: Application of a Participatory Citizen Science Approach to Characterising Air Quality in a Rural Area in The Netherlands;2022-10-01;11.0;Article;True;Amber Woutersen, Henri de Ruiter, Joost Wesseling, Wouter Hendricx, Christa Blokhuis, Sjoerd van Ratingen, Kirsten Vegt, Marita Voogt;scopus;False
SCOPUS_ID:85139200169;Urban diagnostics and a systems approach to air quality management: Pathways towards sustainable economic development and a healthy nairobi, Kenya;2022-09-19;3.0;Article;True;Ajit Singh, Hakeem Bakare, Andrea Mazzeo, William R. Avis, David Ng'ang'a, Michael Gatari, Suzanne E. Bartington, G. Neil Thomas, John R. Bryson, Lauren Andres, Andrew Quinn, Michael Burrow, Elijah N. Ndegwa, George Mwaniki, Tom Randa, Francis D. Pope;scopus;False
SCOPUS_ID:85136595730;Diet variation in a critically endangered marine predator revealed with stable isotope analysis;2022-08-17;13.0;Article;True;Courtney Ogilvy, Rochelle Constantine, Sarah J. Bury, Emma L. Carroll;scopus;False
SCOPUS_ID:85140665797;Calibration and applications of low-cost particle sensors: A review of recent advances;2022-07-18;2.0;Book Chapter;False;Jiayu Li, Pratim Biswas;scopus;False
SCOPUS_ID:85133032182;Heavy metals in moss guide environmental justice investigation: A case study using community science in Seattle, WA, USA;2022-06-01;9.0;Article;True;Sarah E. Jovan, Christopher Zuidema, Monika M. Derrien, Amanda L. Bidwell, Weston Brinkley, Robert J. Smith, Dale Blahna, Roseann Barnhill, Linn Gould, Alberto J. Rodríguez, Michael C. Amacher, Troy D. Abel, Paulina López;scopus;False
SCOPUS_ID:85132120995;Air Quality Sensor Networks for Evidence-Based Policy Making: Best Practices for Actionable Insights;2022-06-01;16.0;Article;True;Jelle Hofman, Jan Peters, Christophe Stroobants, Evelyne Elst, Bart Baeyens, Jo Van Laer, Maarten Spruyt, Wim Van Essche, Elke Delbare, Bart Roels, Ann Cochez, Evy Gillijns, Martine Van Poppel;scopus;False
SCOPUS_ID:85128553843;How IoT-Driven Citizen Science Coupled with Data Satisficing Can Promote Deep Citizen Science;2022-05-01;2.0;Article;True;Stefan Poslad, Tayyaba Irum, Patricia Charlton, Rafia Mumtaz, Muhammad Azam, Hassan Zaidi, Christothea Herodotou, Guangxia Yu, Fesal Toosy;scopus;True
SCOPUS_ID:85129290092;Just air? Spatial injustice and the politicisation of air pollution;2022-05-01;7.0;Editorial;True;Anneleen Kenis, Maarten Loopmans;scopus;False
SCOPUS_ID:85125460389;Field calibration of a low-cost sensors network to assess traffic-related air pollution along the Brenner highway;2022-04-15;19.0;Article;True;Andrea Bisignano, Federico Carotenuto, Alessandro Zaldei, Lorenzo Giovannini;scopus;False
SCOPUS_ID:85128750403;Advances in air quality research - current and emerging challenges;2022-04-11;163.0;Review;True;Ranjeet S. Sokhi, Nicolas Moussiopoulos, Alexander Baklanov, John Bartzis, Isabelle Coll, Sandro Finardi, Rainer Friedrich, Camilla Geels, Tiia Grönholm, Tomas Halenka, Matthias Ketzel, Androniki Maragkidou, Volker Matthias, Jana Moldanova, Leonidas Ntziachristos, Klaus Schäfer, Peter Suppan, George Tsegas, Greg Carmichael, Vicente Franco, Steve Hanna, Jukka Pekka Jalkanen, Guus J.M. Velders, Jaakko Kukkonen;scopus;False
SCOPUS_ID:85128646959;SmartAirQ: A Big Data Governance Framework for Urban Air Quality Management in Smart Cities;2022-04-08;28.0;Review;True;Akshara Kaginalkar, Shamita Kumar, Prashant Gargava, Neelesh Kharkar, Dev Niyogi;scopus;False
SCOPUS_ID:85126936673;Towards the Development of a Sensor Educational Toolkit to Support Community and Citizen Science;2022-04-01;4.0;Article;True;Ashley Collier-Oxandale, Vasileios Papapostolou, Brandon Feenstra, Berj Der Boghossian, Andrea Polidori;scopus;False
SCOPUS_ID:85116106806;The world's longest known parallel temperature dataset: A comparison between daily Glaisher and Stevenson screen temperature data at Adelaide, Australia, 1887–1947;2022-04-01;7.0;Article;True;Linden Ashcroft, Blair Trewin, Mac Benoy, Darren Ray, Catherine Courtney;scopus;False
SCOPUS_ID:85125356426;Characterization of Ambient Air Quality in Selected Urban Areas in Uganda Using Low-Cost Sensing and Measurement Technologies;2022-03-15;38.0;Article;False;Deo Okure, Joel Ssematimba, Richard Sserunjogi, Nancy Lozano Gracia, Maria Edisa Soppelsa, Engineer Bainomugisha;scopus;False
SCOPUS_ID:85126486527;Air Quality Sensors Systems as Tools to Support Guidance in Athletics Stadia for Elite and Recreational Athletes;2022-03-01;11.0;Article;True;Mar Viana, Kostas Karatzas, Athanasios Arvanitis, Cristina Reche, Miguel Escribano, Edurne Ibarrola-Ulzurrun, Paolo Emilio Adami, Fréderic Garrandes, Stéphane Bermon;scopus;False
SCOPUS_ID:85124147012;Monitoring Particulate Matter with Wearable Sensors and the Influence on Student Environmental Attitudes;2022-02-01;11.0;Article;True;Frances Kane, Joseph Abbate, Eric C. Landahl, Mark J. Potosnak;scopus;False
SCOPUS_ID:85124650673;Noise and air pollution during Covid-19 lockdown easing around a school site;2022-02-01;11.0;Article;True;Prashant Kumar, Hamid Omidvarborna, Abhijith Kooloth Valappil, Abigail Bristow;scopus;False
SCOPUS_ID:85123527488;Poor Air Quality in Urban Settings: A Comparison of Perceptual Indicators, Causes and Management in Two Cities;2022-02-01;9.0;Article;True;Timothy M. Chukwu, Stephen Morse, Richard Murphy;scopus;False
SCOPUS_ID:85124282346;Research Priorities of Applying Low-Cost PM2.5 Sensors in Southeast Asian Countries;2022-02-01;25.0;Review;True;Shih Chun Candice Lung, To Thi Hien, Maria Obiminda L. Cambaliza, Ohnmar May Tin Hlaing, Nguyen Thi Kim Oanh, Mohd Talib Latif, Puji Lestari, Abdus Salam, Shih Yu Lee, Wen Cheng Vincent Wang, Ming Chien Mark Tsou, Tran Cong-Thanh, Melliza Templonuevo Cruz, Kraichat Tantrakarnapa, Murnira Othman, Shatabdi Roy, Tran Ngoc Dang, Dwi Agustian;scopus;False
SCOPUS_ID:85118500250;From air quality sensors to sensor networks: Things we need to learn;2022-01-15;21.0;Article;False;Yi Li, Ziyang Yuan, L. W.Antony Chen, Ajay Pillarisetti, Varun Yadav, Mengxian Wu, Houxin Cui, Chuanfeng Zhao;scopus;False
SCOPUS_ID:85149677892;Citizen Science for One Digital Health: A Rapid Qualitative Review of Studies in Air Quality with Reflections on a Conceptual Model;2022-01-01;4.0;Article;True;Timothy Kariotis, Ann Borda, Kenneth Winkel, Kathleen Gray;scopus;False
SCOPUS_ID:85135906329;Participatory Action for Citizens’ Engagement to Develop a Pro-environmental Research Application;2022-01-01;1.0;Conference Paper;True;Anna Jaskulska, Kinga Skorupska, Zuzanna Bubrowska, Kinga Kwiatkowska, Wiktor Stawski, Maciej Krzywicki, Monika Kornacka, Wiesław Kopeć;scopus;True
SCOPUS_ID:85122163113;Establishing A Sustainable Low-Cost Air Quality Monitoring Setup: A Survey of the State-of-the-Art;2022-01-01;79.0;Review;True;Mannam Veera Narayana, Devendra Jalihal, S. M. Shiva Nagendra;scopus;False
SCOPUS_ID:85165077749;Evaluation of Crowd-Sourced PM2.5 Measurements from Low-Cost Sensors for Air Quality Mapping in Stuttgart City;2022-01-01;2.0;Book Chapter;True;Joseph Gitahi, Michael Hahn;scopus;False
SCOPUS_ID:85145008054;Neural Kernel Network Deep Kernel Learning for Predicting Particulate Matter from Heterogeneous Sensors with Uncertainty;2022-01-01;0.0;Conference Paper;False;Chaofan Li, Till Riedel, Michael Beigl;scopus;False
SCOPUS_ID:85119343988;Exploring actionable visualizations for environmental data: Air quality assessment of two Belgian locations;2022-01-01;13.0;Article;False;Gustavo Carro, Olivier Schalm, Werner Jacobs, Serge Demeyer;scopus;False
SCOPUS_ID:85121618157;City Wide Participatory Sensing of Air Quality;2021-12-02;12.0;Article;True;Andrew Rebeiro-Hargrave, Pak Lun Fung, Samu Varjonen, Andres Huertas, Salla Sillanpää, Krista Luoma, Tareq Hussein, Tuukka Petäjä, Hilkka Timonen, Jukka Limo, Ville Nousiainen, Sasu Tarkoma;scopus;False
SCOPUS_ID:85114042370;Monitoring Air Quality in Nigeria: The Case of Center for Atmospheric Research-National Space Research and Development Agency (CAR-NASRDA);2021-12-01;8.0;Article;False;Francis Olawale Abulude, Ifeoluwa Ayodeji Abulude;scopus;False
SCOPUS_ID:85119369944;Vayu: An open-source toolbox for visualization and analysis of crowd-sourced sensor data;2021-11-01;4.0;Article;True;Sachit Mahajan;scopus;True
SCOPUS_ID:85117967439;Tackling Data Quality When Using Low-Cost Air Quality Sensors in Citizen Science Projects;2021-10-12;14.0;Article;True;Ågot K. Watne, Jenny Linden, Jens Willhelmsson, Håkan Fridén, Malin Gustafsson, Nuria Castell;scopus;False
SCOPUS_ID:85117423363;Citizens or consumers? Air quality sensor users and their involvement in sensor.community. results from qualitative case study;2021-10-01;10.0;Article;True;Michał Wróblewski, Joanna Suchomska, Katarzyna Tamborska;scopus;True
SCOPUS_ID:85109217612;Air quality mapping and visualisation: An affordable solution based on a vehicle-mounted sensor network;2021-09-15;26.0;Article;True;Pedro Santana, Alexandre Almeida, Pedro Mariano, Carolina Correia, Vânia Martins, Susana Marta Almeida;scopus;True
SCOPUS_ID:85114034832;A sustainable method for publishing interoperable open data on the web;2021-08-01;4.0;Article;True;Raf Buyle, Brecht Van de Vyvere, Julián Rojas Meléndez, Dwight Van Lancker, Eveline Vlassenroot, Mathias Van Compernolle, Stefan Lefever, Pieter Colpaert, Peter Mechant, Erik Mannens;scopus;True
