identifier;title;coverDate;citedCount;subtypeDescription;openaccessFlag;authors;origin;used
85193287720;The Role of Micromobility in Environmental Monitoring: Reflections and Opportunities on the Use of Pervasive Sensing;2024-04-01;3.0;Article;False;Huber Flores;ieee;False
105015610290;Smart City Environmental Monitoring Based on Internet of Things;2024-01-01;0.0;Conference Paper;False;Mohammed Abdulamer Mohammed, Ahmed Hussian, Mohammed Abed Jawad, Nabaa Rabea Wasmi Zaydan, Sami Hameed Ali, Sehab Shehab;ieee;False
85216900824;A Machine Learning-Based Platform for Monitoring and Prediction of Hazardous Gases in Rural and Remote Areas;2025-01-01;2.0;Article;True;Edgar F. Ladeira, Bruno M.C. Silva;ieee;False
85118102826;Augmented Reality-Assisted Healthcare System for Caregivers in Smart Regions;2021-09-07;8.0;Conference Paper;False;Joo Chan Kim, Saguna Saguna, Christer Ahlund, Karan Mitra;ieee;False
105003201713;Utilizing AI and Metaverse Technologies for the Implementation of Smart City Applications;2024-01-01;0.0;Conference Paper;False;Sandeep Kumar, Ajay Kumar Singh, R. R. Sornalakshmi, Arti Goyal, Neeraj Bhanot, Naveen Naval;ieee;False
85096668536;Smart Health Services for Epidemic Control;2020-09-01;5.0;Conference Paper;False;Aldina R. Avdic, Ulfeta M. Marovac, Dragan S. Jankovic;ieee;False
85174550364;The Infeasibility of Using Reference Nodes in Reputation-Based IoT Sensor Networks;2023-01-01;1.0;Conference Paper;False;Piotr Cofta, Beata Marciniak;ieee;False
85189816836;Implementation of Internet of things in building smart cities;2024-01-01;3.0;Conference Paper;False;Atharva Rana, Rahul Chauhan, Vivek Singh Sajwan, Swati Devliyal, Shefali Gupta;ieee;False
85112086921;IoT-based Ambient Parameters Monitoring Device for in-Home Elderly Care;2021-05-01;9.0;Conference Paper;False;Paraschiv Elena-Anca, Bica Ovidiu, Petrache Cristian, Marilena Ianculescu;ieee;False
85098752968;Regional Smart City Development Focus: The South Korean National Strategic Smart City Program;2021-01-01;91.0;Article;True;Jeyun Yang, Youngsang Kwon, Daehwan Kim;ieee;False
85123349261;Bi2Bi Communication: Toward Encouragement of Sustainable Smart Mobility;2022-01-01;6.0;Article;True;Anas Al-Rahamneh, Jose Javier Astrain, Jesus Villadangos, Hicham Klaina, Imanol Picallo Guembe, Peio Lopez-Iturri, Francisco Falcone;ieee;False
85130784183;Involvement of Surveillance Drones in Smart Cities: A Systematic Review;2022-01-01;122.0;Article;True;Adel Gohari, Anuar Bin Ahmad, Ruzairi Bin Abdul Rahim, A. S.M. Supa'at, Shukor Abd Razak, Mohammed Salih Mohammed Gismalla;ieee;False
85128900844;Evolutionary Computation for Intelligent Transportation in Smart Cities: A Survey;2022-05-01;117.0;Review;True;Zong Gan Chen, Zhi Hui Zhan, Sam Kwong, Jun Zhang;ieee;False
105004872400;A paradigm shift: Low-cost sensors for effective air quality monitoring and management in developing countries;2025-06-01;4.0;Article;True;Muneeba Shabbir, Talha Saeed, Ahmad Saleem, Parkash Bhave, Mike Bergin, Muhammad Fahim Khokhar;science_direct;True
105001298760;Validity, reliability and acceptability of wearable sensor devices to monitor personal exposure to air pollution and pollen: A systematic review of mobility based exposure studies;2025-06-01;1.0;Review;True;Wako Golicha Wako, Tom Clemens, Scott Ogletree, Andrew James Williams, Ruth Jepson;science_direct;False
85149863065;Leveraging machine learning algorithms to advance low-cost air sensor calibration in stationary and mobile settings;2023-05-15;46.0;Article;False;An Wang, Yuki Machida, Priyanka deSouza, Simone Mora, Tiffany Duhl, Neelakshi Hudda, John L. Durant, Fábio Duarte, Carlo Ratti;science_direct;False
85121233629;Air quality monitoring and measurement in an urban airshed: Contextualizing datasets from the Detroit Michigan area from 1952 to 2020;2022-02-25;5.0;Review;False;Brendan F. O'Leary, Alex B. Hill, Katherine G. Akers, Héctor J. Esparra-Escalera, Allison Lucas, Gelareh Raoufi, Yaoxian Huang, Noribeth Mariscal, Sanjay K. Mohanty, Chandra M. Tummala, Timothy M. Dittrich;science_direct;False
105014740872;Modeling nitrogen dioxide concentrations using citizen science data: The case of the Brussels-Capital Region;2025-12-01;0.0;Article;True;Patrick Bogaert, Noémie Huvelle, Axel Briffault, Olivier Brasseur;science_direct;True
105008586332;Key–value data collection with local differential privacy for urban air quality monitoring in crowdsensing;2025-09-01;0.0;Article;False;Yanming Fu, Haodong Lu, Jiayuan Chen, Binyang Luo;science_direct;True
85214246299;Application of artificial intelligence in air pollution monitoring and forecasting: A systematic review;2025-02-01;15.0;Review;True;Sreeni Chadalavada, Oliver Faust, Massimo Salvi, Silvia Seoni, Nawin Raj, U. Raghavendra, Anjan Gudigar, Prabal Datta Barua, Filippo Molinari, Rajendra Acharya;science_direct;False
85199033859;Classification, sources, and occurrence of outdoor air pollutants: a comprehensive overview;2024-01-01;8.0;Book Chapter;False;Rama Rao Karri, Teresa Vera, Salwa Kamal Mohamed Hassan, Mamdouh I. Khoder, Mohammad Hadi Dehghani, Nabisab Mujawar Mubarak, Gobinath Ravindran;science_direct;False
85193909792;Review of agricultural biomass burning and its impact on air quality in the continental United States of America;2024-07-01;14.0;Review;True;Sai Deepak Pinakana, Amit U. Raysoni, Alqamah Sayeed, Juan L. Gonzalez, Owen Temby, Dawid Wladyka, Katarzyna Sepielak, Pawan Gupta;science_direct;False
105004039711;CyanoHABs and CAPs: assessing community-based monitoring of PM2.5 with regional sources of pollution in rural, northeastern North Carolina;2025-04-15;0.0;Article;True;Haley E. Plaas, Colleen Karl, Rachael Cogbill, Nicole Rosales-Garcia, Ashley H. Stoop, Lisa L. Satterwhite, Martine E. Mathieu-Campbell, Jennifer Richmond-Bryant, Hans W. Paerl, Douglas S. Hamilton;science_direct;True
85218272471;Ten questions concerning older people and a sustainable built environment;2025-04-15;4.0;Article;True;J. van Hoof, V. Soebarto, L. Ayalon, H. R. Marston, K. K. Zander, J. Dikken, J. K. Kazak;science_direct;False
85212830765;Spatio-temporal analysis of extreme air pollution and risk assessment;2025-01-01;3.0;Article;False;Kuldeep Singh Rautela, Manish Kumar Goyal;science_direct;False
85195261549;Breathing in danger: Understanding the multifaceted impact of air pollution on health impacts;2024-07-15;43.0;Article;True;Fu Chen, Wanyue Zhang, Manar Fawzi Bani Mfarrej, Muhammad Hamzah Saleem, Khalid Ali Khan, Jing Ma, António Raposo, Heesup Han;science_direct;False
85081923776;Evaluation of low-cost sensors for quantitative personal exposure monitoring;2020-06-01;77.0;Article;False;Sachit Mahajan, Prashant Kumar;science_direct;False
85114806307;Tutorial: Guidelines for implementing low-cost sensor networks for aerosol monitoring;2022-01-01;63.0;Article;True;Naomi Zimmerman;science_direct;True
85115386989;AI for Social Good: AI and Big Data Approaches for Environmental Decision-Making;2021-11-01;25.0;Editorial;False;Victor O.K. Li, Jacqueline C.K. Lam, Jiahuan Cui;science_direct;False
105001016699;Dataset on indoor and outdoor PM2.5 concentrations at two residences using low-cost sensors in the Rio Grande Valley Region of South Texas;2025-06-01;0.0;Data Paper;True;Kabir Bahadur Shah, Sai Deepak Pinakana, Mkhitar Hobosyan, Armando Montes, Amit U. Raysoni;science_direct;False
85147564959;Mining association rules between lichens and air quality to support urban air quality monitoring in Nigeria;2023-01-01;8.0;Article;True;Olanrewaju Lawal, Chimezie Jason Ogugbue, Tijjani Sabiu Imam;science_direct;False
105005418966;Advancing participatory sensing and knowledge production methods for city air quality governance: Applying the Breathe London Community Programme model;2025-08-01;1.0;Article;True;Kayla Schulte, Andrew Grieve, Benjamin Barratt, Timothy Baker, Hima Coonjobeeharry, Mohammed Mead;science_direct;True
85102425635;Using historical atmospheric pollution data to prioritize environmental sampling in urban areas;2020-04-01;2.0;Article;True;Matthew Dietrich;science_direct;False
105004874335;Bayesian modeling of traffic-related air pollutants: A case study of urban transportation and air quality dynamics in Columbia, South Carolina;2025-04-01;0.0;Article;True;Yihong Ning, Ruixiao Sun, David Hitchcock, Gurcan Comert, Yuche Chen;science_direct;False
85214380457;Pathway to design a multiparameter application for environmental monitoring to contribute to citizen well-being;2024-06-01;1.0;Review;True;Jules Sekedoua Kouadio, Emeric Grandvaux, Anabelle Waksberg;science_direct;True
85182424548;Calibrating low-cost sensors using MERRA-2 reconstructed PM2.5 mass concentration as a proxy;2024-03-01;3.0;Article;False;Vasudev Malyan, Vikas Kumar, Manoranjan Sahu, Jai Prakash, Shruti Choudhary, Ramesh Raliya, Tandeep S. Chadha, Jiaxi Fang, Pratim Biswas;science_direct;False
105001139275;A scalable framework for harmonizing, standardization, and correcting crowd-sourced low-cost sensor PM2.5 data across Europe;2025-04-01;4.0;Article;True;Amirhossein Hassani, Vasileios Salamalikis, Philipp Schneider, Kerstin Stebel, Núria Castell;science_direct;True
105010586507;CHIP toolkit: Social mapping and transect walk for childhood infection and pollution – A comparative study across four cities (Jaipur, Jakarta, Antofagasta, and Istanbul);2025-12-01;0.0;Article;True;Logan Manikam, Kunal D. Kondhare, Kalpita Shringarpure, Margi Sheth, Pam Factor-Livak, Priti Parikh, Hector Altamirano-Medina, Dewi Nur Aisyah, Radhika Sharma, Darlington David Faijue, Pradeep Kumar Srivastava, Hein Min Tun, Nancy H.L. Leung, Chyntia Mayadewi, Hemant Chaturvedi, Kaushik Sarkar, Monica Lakhanpaul;science_direct;False
105000702279;Optimizing air pollution sensing for social and environmental justice;2025-05-01;1.0;Article;False;Yue Lin, Caitlin Robinson, Qian Fang Yeap, Helen Michael;science_direct;False
85141229017;Conservation ethics in the time of the pandemic: Does increasing remote access advance social justice?;2022-12-01;3.0;Article;False;Abraham J. Miller-Rushing, Elizabeth R. Ellwood, Theresa M. Crimmins, Amanda S. Gallinat, Molly Phillips, Ronald L. Sandler, Richard B. Primack;science_direct;False
85089092141;A reusable & reconfigurable Citizen Observatory platform;2021-01-01;8.0;Article;False;Jesse Zaman, Kennedy Kambona, Wolfgang De Meuter;science_direct;True
85119916807;AirSensor v1.0: Enhancements to the open-source R package to enable deep understanding of the long-term performance and reliability of PurpleAir sensors;2022-02-01;14.0;Article;True;Ashley Collier-Oxandale, Brandon Feenstra, Vasileios Papapostolou, Andrea Polidori;science_direct;True
85108422789;Intra-city variability of fine particulate matter during COVID-19 lockdown: A case study from Park City, Utah;2021-10-01;6.0;Article;True;Daniel L. Mendoza, Tabitha M. Benney, Ryan Bares, Erik T. Crosman;science_direct;False
85201758975;Municipal circular economy indicators: Do they measure the cities' environmental ambitions?;2024-10-01;6.0;Article;True;Mira Kopp, Anna Petit-Boix, Sina Leipold;science_direct;False
85216380647;Mobile Crowdsensing and Remote Sensing in Smart Cities: An Introduction;2025-01-01;0.0;Book Chapter;False;G. Tony Santhosh;science_direct;False
85139930068;Citizen science monitoring of air pollution: Challenges and experiences from the six iSCAPE living labs;2020-01-01;5.0;Book Chapter;False;Francesco Pilla, Katinka Schaaf, Lee Markham;science_direct;True
85142088540;The role of IoT in smart cities: Challenges of air quality mass sensor technology for sustainable solutions;2020-01-01;4.0;Book Chapter;False;Alok Pradhan, Bhuvan Unhelkar;science_direct;True
85115072004;Review of urban computing in air quality management as smart city service: An integrated IoT, AI, and cloud technology perspective;2021-09-01;168.0;Review;False;Akshara Kaginalkar, Shamita Kumar, Prashant Gargava, Dev Niyogi;science_direct;True
85218877006;Empowering communities: Advancements in air quality monitoring and citizen engagement;2025-03-01;5.0;Article;True;Hélder Relvas, Diogo Lopes, Jan Mateu Armengol;science_direct;True
105017224618;Intelligence frameworks for environmental pollution assessment: a review on air and water quality monitoring systems;2026-01-30;0.0;Review;False;Alok Kumar Pati, Alok Ranjan Tripathy, Sonalika Subudhi;science_direct;False
85111848262;Assessing air pollution in European cities to support a citizen centered approach to air quality management;2021-12-10;33.0;Article;True;V. Rodrigues, C. Gama, A. Ascenso, K. Oliveira, S. Coelho, A. Monteiro, E. Hayes, M. Lopes;science_direct;False
85082400458;Acquiring air quality monitoring data through the hierarchy or the market: A case study of Shandong province, China;2020-06-25;4.0;Article;False;Wanxin Li, Chunlei Huang;science_direct;False
105014799070;Urban pollution impact assessment in six lithuanian cities with a focus on road traffic emissions - integrated framework for environmental health studies;2025-10-05;0.0;Article;True;Simonas Kecorius, Leizel Madueño, Wolfram Birmili, Jakob Löndahl, Kristina Plauškaitė, Steigvilė Byčenkienė, Mario Lovrić, Valentino Petrić, Manuel Carranza-García, Manuel J. Jiménez-Navarro, María Martínez-Ballesteros, Magdalena Weiss, Otmar Schmid, Josef Cyrys, Annette Peters, Gaudentas Kecorius;science_direct;False
85188534388;Using dispersion models at microscale to assess long-term air pollution in urban hot spots: A FAIRMODE joint intercomparison exercise for a case study in Antwerp;2024-05-15;22.0;Article;True;F. Martín, S. Janssen, V. Rodrigues, J. Sousa, J. L. Santiago, E. Rivas, J. Stocker, R. Jackson, F. Russo, M. G. Villani, G. Tinarelli, D. Barbero, R. San José, J. L. Pérez-Camanyo, G. Sousa Santos, J. Bartzis, I. Sakellaris, Z. Horváth, L. Környei, B. Liszkai, None Kovács, X. Jurado, N. Reiminger, P. Thunis, C. Cuvelier;science_direct;False
85206475423;Pinpointing sources of pollution using citizen science and hyperlocal low-cost mobile source apportionment;2024-11-01;7.0;Article;True;Dimitrios Bousiotis, Seny Damayanti, Arunik Baruah, Alessandro Bigi, David C.S. Beddows, Roy M. Harrison, Francis D. Pope;science_direct;True
85207774542;Data fusion for enhancing urban air quality modeling using large-scale citizen science data;2024-12-01;5.0;Article;True;Anna C. O'Regan, Henrik Grythe, Stig Hellebust, Susana Lopez-Aparicio, Colin O'Dowd, Paul D. Hamer, Gabriela Sousa Santos, Marguerite M. Nyhan;science_direct;True
85217413494;Understanding the effect of built-up and green spaces upon air quality at multiple spatial scales: A systematic literature review;2025-05-01;5.0;Review;True;Chenling Wu, Ahmed Hazem Eldesoky, Eugenio Morello;science_direct;False
105014001395;Toward satisfactory public accessibility: A crowdsourcing approach through online reviews to inclusive urban design;2025-12-01;0.0;Article;False;Lingyao Li, Songhua Hu, Yinpei Dai, Min Deng, Parisa Momeni, Gabriel Laverghetta, Lizhou Fan, Zihui Ma, Xi Wang, Siyuan Ma, Jay Ligatti, Libby Hemphill;science_direct;False
85182377800;Improving air pollution awareness of the general public through citizen science approach;2024-06-01;26.0;Article;True;K. V. Abhijith, Prashant Kumar, Hamid Omidvarborna, Ana Paula Mendes Emygdio, Ben McCallan, David Carpenter-Lomax;science_direct;True
85202897313;Revealing air quality dynamics: Leveraging remote sensing and GIS for active monitoring and risk evaluation;2024-01-01;2.0;Book Chapter;False;Hamaad Raza Ahmad, Khalid Mehmood, S. Saifullah, Sadia Bibi, Muhammad Hassan Bashir, Ayesha Siddique;science_direct;False
85107114207;Large-scale citizen science provides high-resolution nitrogen dioxide values and health impact while enhancing community knowledge and collective action;2021-10-01;27.0;Article;True;Josep Perelló, Anna Cigarini, Julián Vicens, Isabelle Bonhoure, David Rojas-Rueda, Mark J. Nieuwenhuijsen, Marta Cirach, Carolyn Daher, Jaume Targa, Anna Ripoll;science_direct;True
85213328119;An approach for air quality monitor in the university workspaces;2024-01-01;0.0;Conference Paper;True;Anca Diana Bibiri, Liviu Andrei Scutelnicu;science_direct;True
85076286169;Crowd-sourced allergic rhinitis symptom data: The influence of environmental and demographic factors;2020-02-25;24.0;Article;False;Jeremy D. Silver, Kymble Spriggs, Simon Haberle, Constance H. Katelaris, Edward J. Newbigin, Edwin R. Lampugnani;science_direct;True
85218365875;Low-cost sensors for air quality monitoring;2024-01-01;0.0;Book Chapter;False;Hamid Omidvarborna, Prashant Kumar;science_direct;False
85150755422;CLEAN - Collaborative low-cost environmental and air-quality network;2023-05-01;6.0;Article;False;Fernando Campo, Davide Franco, Felipe de Campos Santos, Andy Blanco-Rodríguez, Alejandro Rafael Garcia-Ramirez, Gabriel Ratão, Leonardo Hoinaski;science_direct;True
85209657547;Supporting knowledge justice through community science air quality monitoring and a reciprocal reporting process;2024-12-01;1.0;Article;True;Valentina Serrano-Salomón, Marisa Westbrook, Noemy Pérez, Jay Pecenka, Aniya Khalili, Sumit Sankhyan, Shelly Miller, Shivakant Mishra, Esther Sullivan;science_direct;True
105007641761;Towards blue skies: A comprehensive review and regional mapping of ambient air quality in Indonesian cities;2025-08-01;1.0;Review;True;Kevin Muhamad Lukman, Lathifah Puji Hastuti, Dina Oktavia, Desty Pratiwi, Yuta Uchiyama, Diana Harding;science_direct;False
85071615346;A citizen science approach for enhancing public understanding of air pollution;2020-01-01;126.0;Article;False;Sachit Mahajan, Prashant Kumar, Janaina Antonino Pinto, Agnese Riccetti, Katinka Schaaf, Guillem Camprodon, Viktor Smári, Antonella Passani, Giuseppe Forino;science_direct;True
105002897922;Application of the application of the compact and useful PM2.5 instrument with gas sensors (CUPI-G) for high temporal and spatial resolution monitoring with weather factor integration;2025-06-01;0.0;Article;False;Anuva Bhowmick, Suwanna Kitpati Boontanon, Louise Olsen-Kettle, Yali Li, Narin Boontanon, Yosuke Sakamoto, Kentaro Murano, Yoshizumi Kajii, Ranjna Jindal;science_direct;False
105010933803;Assessment of IoT low-cost sensor networks for long-term outdoor and indoor air quality monitoring: a case study in Dublin;2025-11-01;0.0;Article;True;Jiayao Chen, Óscar González, David O'Connor, Lindsay Tallon, Francesco Pilla;science_direct;False
85179005476;Schools’ air quality monitoring for health and education: Methods and protocols of the SAMHE initiative and project;2023-12-01;18.0;Article;True;Lia Chatzidiakou, Rhys Archer, Victoria Beale, Sam Bland, Holly Carter, Claudia Castro-Faccetti, Hannah Edwards, Joshua Finneran, Sarkawt Hama, Roderic L. Jones, Prashant Kumar, Paul F. Linden, Nidhi Rawat, Katherine Roberts, Charles Symons, Carolanne Vouriot, Douglas Wang, Lucy Way, Sarah West, Dale Weston, Natalie Williams, Samuel Wood, Henry C. Burridge;science_direct;True
85094325999;Performance assessment of low-cost environmental monitors and single sensors under variable indoor air quality and thermal conditions;2021-01-01;140.0;Article;True;Ingrid Demanega, Igor Mujan, Brett C. Singer, Aleksandar S. Anđelković, Francesco Babich, Dusan Licina;science_direct;False
85153567489;Citizen-operated mobile low-cost sensors for urban PM2.5 monitoring: field calibration, uncertainty estimation, and application;2023-08-01;26.0;Article;True;Amirhossein Hassani, Núria Castell, Ågot K. Watne, Philipp Schneider;science_direct;True
105007622322;Driving climate action with the VISUALIZER: A dashboard for transportation emissions data analysis & visualization;2025-06-01;0.0;Article;False;Timothy Fraser, H. Oliver Gao;science_direct;False
85207286282;Democratizing air: A co-created citizen science approach to indoor air quality monitoring;2024-12-01;3.0;Article;True;Sachit Mahajan, Rosy Mondardini, Dirk Helbing;science_direct;True
85183872086;Digital Citizenship and Sustainable Governance: A Design Thinking Approach;2024-01-01;2.0;Conference Paper;True;Belinha Herrera Tapias, Diego Hernández Guzmán, Paola Carvajal Muñoz, Nathaly Reyes Duarte;science_direct;False
85219684451;Advancing air quality monitoring systems towards sustainable green development: Insight for metropolitan cities in Indonesia;2025-06-01;0.0;Review;True;Hunggul Yudono Setio Hadi Nugroho, Tyas Mutiara Basuki, None Pratiwi, Endang Savitri, Agung Budi Supangat, Pamungkas Buana Putra, None Purwanto, Nining Wahyuningrum, Rahardyan Nugroho Adi, Ogi Setiawan, Ryke Nandini, Sigit Andy Cahyono, Diah Auliyani, Firda Maftukhakh Hilmya Nada, Dian Pratiwi, Muhammad Hasani;science_direct;False
85140887909;Predicting the quality of air with machine learning approaches: Current research priorities and future perspectives;2022-12-15;43.0;Article;False;Khalid Mehmood, Yansong Bao, None Saifullah, Wei Cheng, Muhammad Ajmal Khan, Nadeem Siddique, Muhammad Mohsin Abrar, Ahmad Soban, Shah Fahad, Ravi Naidu;science_direct;False
85199318764;Assessing the spatial transferability of calibration models across a low-cost sensors network;2024-09-01;4.0;Article;False;Vasudev Malyan, Vikas Kumar, Mufaddal Moni, Manoranjan Sahu, Jai Prakash, Shruti Choudhary, Ramesh Raliya, Tandeep S. Chadha, Jiaxi Fang, Pratim Biswas;science_direct;False
85213540557;Machine learning in healthcare citizen science: A scoping review;2025-03-01;1.0;Review;False;Ranga Baminiwatte, Blessing Torsu, Dmitry Scherbakov, Abolfazl Mollalo, Jihad S. Obeid, Alexander V. Alekseyenko, Leslie A. Lenert;science_direct;False
85103950752;COVID-19 pandemic impacts on conservation research, management, and public engagement in US national parks;2021-05-01;88.0;Article;True;Abraham J. Miller-Rushing, Nicole Athearn, Tami Blackford, Christy Brigham, Laura Cohen, Rebecca Cole-Will, Todd Edgar, Elizabeth R. Ellwood, Nicholas Fisichelli, Colleen Flanagan Pritz, Amanda S. Gallinat, Adam Gibson, Andy Hubbard, Sierra McLane, Koren Nydick, Richard B. Primack, Susan Sachs, Paul E. Super;science_direct;False
85104947027;Comparative assessments and insights of data openness of 50 smart cities in air quality aspects;2021-06-01;56.0;Article;False;Hugo Wai Leung Mak, Yun Fat Lam;science_direct;True
85165375828;Perceptions of volcanic air pollution and exposure reduction practices on the Island of Hawai‘i: Working towards socially relevant risk communication;2023-09-01;1.0;Article;True;C. J. Horwell, T. Elias, J. Covey, R. Bhandari, J. Truby;science_direct;False
85196152325;Towards integration of LOTOS-EUROS high resolution simulations and heterogenous low-cost sensor observations;2024-09-15;2.0;Article;True;Ioanna Skoulidou, Arjo Segers, Bas Henzing, Jun Zhang, Ruben Goudriaan, Maria Elissavet Koukouli, Dimitrios Balis;science_direct;True
85203819137;Implementation of an IoT architecture for promoting healthy air quality in 84 homes of families with children;2024-12-01;3.0;Article;True;Marta Fonseca Gabriel, Gonçalo Marques, David Filipe, Fátima Felgueiras, João Pedro Cardoso, Joana Azeredo, Giannis Kazdaridis, Polychronis Symeonidis, Stratos Keranidis, Peter Conradie, Isabel Azevedo, Filippos Anagnostopoulos;science_direct;True
85179077360;Leveraging crowd-sourced environmental data to assess air pollution exposure disparity: A case of Los Angeles County;2023-12-01;6.0;Review;True;Tianjun Lu, Dulce A. Garcia, Armando Garcia, Yisi Liu;science_direct;False
85151817584;DQ-MAN: A tool for multi-dimensional data quality analysis in IoT-based air quality monitoring systems;2023-07-01;8.0;Article;True;Julio H. Buelvas, Danny Múnera, Natalia Gaviria;science_direct;False
85192671802;Why we should have a universal air quality index?;2024-05-01;10.0;Article;True;Khaiwal Ravindra, Vikas Singh, Suman Mor;science_direct;False
105010330621;A review of case study-based academic literature on public participation in sustainable mobility;2025-09-01;0.0;Article;True;Femke Bekius, Jaap van der Waerden, Gerdien de Vries, Rob van der Heijden, Josefa Janssen;science_direct;False
105015981637;Living labs and urban governance: Addressing complexity for environmental transition - case study of air pollution in Ferrara, Italy;2025-01-01;0.0;Article;True;Farah Makki, Eugenio Morello;science_direct;False
85099794565;Estimating hourly PM2.5 concentrations at the neighborhood scale using a low-cost air sensor network: A Los Angeles case study;2021-04-01;76.0;Article;False;Yougeng Lu, Genevieve Giuliano, Rima Habre;science_direct;True
85122348896;Exploring the distributional environmental justice implications of an air quality monitoring network in Los Angeles County;2022-04-15;37.0;Article;False;Casey Mullen, Aaron Flores, Sara Grineski, Timothy Collins;science_direct;True
85169918913;Defining environmental justice communities: Evaluating digital infrastructure in Southeastern states for Justice40 benefits allocation;2023-09-01;10.0;Article;False;Marisa Sotolongo;science_direct;False
85175146512;Investigating the barriers and pathways to implementing satellite data into air quality monitoring, regulation and policy design in the United Kingdom;2024-01-01;6.0;Article;True;Daniel A. Potts, Emma J.S. Ferranti, Joshua D.Vande Hey;science_direct;False
105007787370;Environmental and health monitoring in smart cities: A systematic review of trends, opportunities, and challenges;2025-07-15;2.0;Article;False;Andy Hong, Dong ah Choi, Haejoo Chung, Prashant Kumar, Jeongwoo Lee;science_direct;False
85182605168;MitH: A framework for Mitigating Hygroscopicity in low-cost PM sensors;2024-02-01;5.0;Article;True;Martina Casari, Laura Po;science_direct;False
86000445492;Collaborative data innovation: developing a theoretical and empirical understanding of drivers, barriers and outcomes;2025-01-01;0.0;Article;False;Albert Meijer, Krista Ettlinger;science_direct;True
